id,title,start_date,end_date,synopsis,mean,rank,popularity,num_list_users,num_scoring_users,nsfw,media_type,status,genres,num_episodes,source,average_episode_duration,rating,studios,movie_ranking,broadcast_day_of_the_week,broadcast_start_time,start_season_year,start_season_season,statistics_watching,statistics_completed,statistics_on_hold,statistics_dropped,statistics_plan_to_watch,statistics_num_list_users,positive_viewership_fraction,negative_viewership_fraction
9252,Break Blade 3: Kyoujin no Ato,2010-09-25,2010-09-25,Third Break Blade movie.,7.79,882,2439,56696,34600,white,movie,finished_airing,"[{'id': 1, 'name': 'Action'}, {'id': 10, 'name': 'Fantasy'}, {'id': 18, 'name': 'Mecha'}, {'id': 38, 'name': 'Military'}, {'id': 27, 'name': 'Shounen'}]",1,manga,2863,r,"[{'id': 10, 'name': 'Production I.G'}, {'id': 27, 'name': 'Xebec'}]",207,,,2010.0,summer,532.0,48262.0,305.0,220.0,7381.0,56700.0,0.9907,0.0093
4447,Detective Conan Movie 12: Full Score of Fear,2008-04-19,2008-04-19,"Serial murders involving all kinds have happened. All the victims are from a Music School led by a famous pianist. Conan and company have been invited to a opening concert of the Music Hall built by the pianist. The biggest attraction of this concert is the world famous violin called ""Stradivarius"" and a special appearance of a singer who has perfect pitch. 

(Source: ANN)",7.79,884,2856,41715,24195,white,movie,finished_airing,"[{'id': 2, 'name': 'Adventure'}, {'id': 4, 'name': 'Comedy'}, {'id': 7, 'name': 'Mystery'}, {'id': 39, 'name': 'Police'}, {'id': 27, 'name': 'Shounen'}]",1,manga,6960,pg_13,"[{'id': 73, 'name': 'TMS Entertainment'}]",208,,,2008.0,spring,418.0,37170.0,225.0,242.0,3701.0,41756.0,0.9888,0.0112
33280,Gochuumon wa Usagi Desu ka??: Dear My Sister,2017-11-11,2017-11-11,"Cocoa visits her family, in the mountains, after quite some time again after her sister Mocha wrote her, through a letter, to come back soon. Her friends will have to spend a week in the town without her, while Cocoa has time with her family that she hasn't seen for a long time. But Chino, Cocoa's self proclaimed little sister, wants to go watch, with Cocoa and all her friends, the fireworks in the fireworks festival, which is coming up in less than a week. Cocoa decides to return early as she misses them all, but will she arrive in time for the climax of the festival?

(Source: TMDB)",7.79,885,3094,36144,14388,white,movie,finished_airing,"[{'id': 4, 'name': 'Comedy'}, {'id': 36, 'name': 'Slice of Life'}]",1,4_koma_manga,3540,pg_13,"[{'id': 1669, 'name': 'production doA'}]",209,,,2017.0,fall,1028.0,19022.0,386.0,239.0,15616.0,36291.0,0.9828,0.0172
8142,Colorful (Movie),2010-08-21,2010-08-21,"Upon arriving at the train station of death, an impure soul is granted a second chance at life against his will. Reincarnating into the body of Makoto Kobayashi, a 14-year-old boy who recently committed suicide, the soul is tasked to identify the boy's greatest sin in life within a time limit of six months. Although it remains reluctant toward continuing life as Makoto, the soul soon begins to notice the complexities of people's emotions and actions.

Deconstructing the ideas of fractured families and suicide, Colorful explores the intricacies of the daily struggles humans face but are too abashed to confront.

[Written by MAL Rewrite]",7.78,890,1074,173470,75988,white,movie,finished_airing,"[{'id': 8, 'name': 'Drama'}, {'id': 36, 'name': 'Slice of Life'}, {'id': 37, 'name': 'Supernatural'}]",1,novel,7620,pg_13,"[{'id': 14, 'name': 'Sunrise'}, {'id': 473, 'name': 'Ascension'}]",210,,,2010.0,summer,3483.0,96193.0,1605.0,907.0,71429.0,173617.0,0.9855,0.0145
1824,Hadashi no Gen,1983-07-21,1983-07-21,"It's the summer of 1945. 3 years have elapsed since the war between Japan and USA began. Gen is a young boy living a struggling yet satisfying life in the city of Hiroshima, that has been strangely spared by the bombing taken in almost every other Japanese City. Food is scarce, and Gen's family is suffering from severe malnutrition, which endangers his pregnant mother. There isn't much spare time as Gen and his little brother Shinji help their father and mother at work and try to make sure their family survives the tough times. Little do they know, what the Americans have in store for the city of Hiroshima and as of the 6th of August 1945, their lives are about to change dramatically.

(Source: ANN) ",7.78,893,2774,43630,16668,white,movie,finished_airing,"[{'id': 8, 'name': 'Drama'}, {'id': 13, 'name': 'Historical'}]",1,manga,4980,pg_13,"[{'id': 11, 'name': 'Madhouse'}]",211,,,1983.0,summer,906.0,21132.0,500.0,272.0,20911.0,43721.0,0.9823,0.0177
35082,Hibike! Euphonium Movie 2: Todoketai Melody,2017-09-30,2017-09-30,"Following their success in the qualifying round for the Kansai regional competition, the members of the Kitauji High School concert band set their sights on the next upcoming performance. Utilizing their summer break to the utmost, the band participates in a camp where they are instructed by their band advisor Noboru Taki and his friends who make their living as professional musicians.

Kumiko Oumae and her friends remain determined to attain gold at the Kansai competition, but trouble arises when a student who once quit the band shows interest in rejoining and sparks unpleasant memories for the second-year members. Kumiko also learns about her teacher's surprising past and the motivation behind his desire to lead the band to victory. Reaching nationals will require hard work, and the adamant conviction in each student's commitment to the band will be put to the test.

[Written by MAL Rewrite]",7.78,895,3748,24812,5829,white,movie,finished_airing,"[{'id': 8, 'name': 'Drama'}, {'id': 19, 'name': 'Music'}, {'id': 23, 'name': 'School'}]",1,novel,6900,pg_13,"[{'id': 2, 'name': 'Kyoto Animation'}]",212,,,2017.0,summer,626.0,8584.0,353.0,283.0,15040.0,24886.0,0.9744,0.0256
570,Jin-Rou,2000-06-03,2000-06-03,"In an alternate history, following World War II, civil unrest and terrorism run rampant in a devastated Japan under foreign occupation. During a botched interception of underground munitions being transferred by a terrorist organization, Constable Kazuki Fuse, a soldier in an elite counter-terrorism unit, witnesses the true terror of human nature. He fails to prevent a teenage girl from carrying out a desperate suicide bombing that subsequently causes immense destruction to Tokyo. With mental scars and his competence under question, Kazuki is sent back to the military academy for re-evaluation. Unbeknownst to him, he will soon be caught up in a web of government conspiracies that have the power to determine the future of all of Japan.

Jin-Rou is a heart-wrenching tale of a man treading the fine line between human and beast, ultimately discovering to which side he truly belongs.

[Written by MAL Rewrite]",7.78,899,1261,147000,65317,white,movie,finished_airing,"[{'id': 8, 'name': 'Drama'}, {'id': 38, 'name': 'Military'}, {'id': 39, 'name': 'Police'}, {'id': 40, 'name': 'Psychological'}, {'id': 22, 'name': 'Romance'}]",1,manga,6120,r,"[{'id': 10, 'name': 'Production I.G'}]",213,,,2000.0,spring,3732.0,82661.0,1337.0,718.0,58805.0,147253.0,0.986,0.014
875,Mind Game,2004-08-07,2004-08-07,"After seeing her jump onto a subway at the last second and getting her ankle crushed between the doors, Nishi reconnects with his high school sweetheart, Myon. Nishi is still very much in love with Myon, but is shocked to learn that she is engaged to another man. Nishi agrees to meet Myon's fiancé at her family's Yakitori restaurant, but members of the Yakuza storm the joint and murder Nishi when he tries to stop them from raping Myon.

Nishi, now dead, wakes up and meets a constantly shapeshifting god, who mocks him for dying. The god tells Nishi to walk into a portal and disappear from existence, which Nishi rejects, choosing instead to sprint past the god and reanimate. With a new outlook on life and knowledge of how the Yakuza are going to attack him, Nishi kills one of the Yakuza with his own gun, fleeing in a stolen car with Myon and her sister.

Acclaimed director Masaaki Yuasa's debut film, Mind Game's constantly shifting visuals tell a story about living one's life without regrets that is unlike any other.

[Written by MAL Rewrite]",7.78,905,2138,70044,26866,white,movie,finished_airing,"[{'id': 2, 'name': 'Adventure'}, {'id': 5, 'name': 'Avant Garde'}, {'id': 4, 'name': 'Comedy'}, {'id': 40, 'name': 'Psychological'}, {'id': 22, 'name': 'Romance'}]",1,manga,6187,r,"[{'id': 13, 'name': 'Studio 4°C'}]",214,,,2004.0,summer,1516.0,33311.0,765.0,556.0,33990.0,70138.0,0.9812,0.0188
28881,New Initial D Movie: Legend 2 - Tousou,2015-05-23,2015-05-23,"After witnessing the race between Takumi Fujiwara's Toyota AE86 and Keisuke Takahashi's Mazda RX7, Takeshi Nakazato from the Myougi Night Kids sends out a challenge to defeat the AE86 in a downhill battle. Despite his Nissan Skyline GT-R completely outclassing the AE86, Nakazato is told that he will never beat Takumi—a statement that enrages him. Believing that grip racing is far superior to flashy drift racing, Nakazato is dead set on defeating the AE86 to prove that he is the better racer.

Thanks to Itsuki Takeuchi's hasty acceptance of the match on his behalf, Takumi is reluctant to get involved with the challenge and chooses not to race, stating that he is not a racer by any means. Overseeing the dilemma, Takumi's employer goads him into accepting. However, when Takumi returns home to get the AE86, he finds that his father has taken the car out for himself. As he waits for his father's return, Takumi begins to feel his itch to race grow ever more.

[Written by MAL Rewrite]",7.78,906,3807,24076,11652,white,movie,finished_airing,"[{'id': 3, 'name': 'Cars'}, {'id': 42, 'name': 'Seinen'}, {'id': 30, 'name': 'Sports'}]",1,manga,3600,pg_13,"[{'id': 537, 'name': 'SANZIGEN'}, {'id': 839, 'name': 'LIDENFILMS'}]",215,,,2015.0,spring,464.0,16943.0,188.0,203.0,6278.0,24076.0,0.9838,0.0162
40814,Seitokai Yakuindomo Movie 2,2021-01-01,2021-01-01,no_synopsis,7.78,908,3780,24435,5135,white,movie,finished_airing,"[{'id': 4, 'name': 'Comedy'}, {'id': 23, 'name': 'School'}, {'id': 27, 'name': 'Shounen'}, {'id': 36, 'name': 'Slice of Life'}]",1,4_koma_manga,4800,r,"[{'id': 309, 'name': 'GoHands'}]",216,,,2021.0,winter,780.0,6940.0,377.0,95.0,16321.0,24513.0,0.9807,0.0193
36702,Shingeki no Kyojin Season 2 Movie: Kakusei no Houkou,2018-01-13,2018-01-13,"Eren Yeager and others of the 104th Training Corps have just begun to become full members of the Survey Corps. As they ready themselves to face the Titans once again, their preparations are interrupted by the invasion of Wall Rose—but all is not as it seems as more mysteries are unraveled. As the Survey Corps races to save the wall, they uncover more about the invading Titans and the dark secrets of their own members.
 
[Written by MAL Rewrite]",7.78,910,2476,54884,15115,white,movie,finished_airing,"[{'id': 1, 'name': 'Action'}, {'id': 8, 'name': 'Drama'}, {'id': 10, 'name': 'Fantasy'}, {'id': 27, 'name': 'Shounen'}, {'id': 31, 'name': 'Super Power'}]",1,manga,7236,r,"[{'id': 858, 'name': 'Wit Studio'}]",217,,,2018.0,winter,1383.0,26668.0,706.0,693.0,25715.0,55165.0,0.9746,0.0254
16870,The Last: Naruto the Movie,2014-12-06,2014-12-06,"Two years have passed since the end of the Fourth Great Ninja War. Konohagakure has remained in a state of peace and harmony—until Sixth Hokage Kakashi Hatake notices the moon is dangerously approaching the Earth, posing the threat of planetary ruin.

Amidst the grave ordeal, the Konoha is invaded by a new evil, Toneri Oosutuski, who suddenly abducts Hinata Hyuuga's little sister Hanabi. Kakashi dispatches a skilled ninja team comprised of Naruto Uzumaki, Sakura Haruno, Shikamaru Nara, Sai, and Hinata in an effort to rescue Hanabi from the diabolical clutches of Toneri. However, during their mission, the team faces several obstacles that challenge them, foiling their efforts.

With her abduction, the relationships the team share with one another are tested, and with the world reaching the brink of destruction, they must race against time to ensure the safety of their planet. Meanwhile, as the battle ensues, Naruto is driven to fight for something greater than he has ever imagined—love.

[Written by MAL Rewrite]",7.78,913,347,498384,333272,white,movie,finished_airing,"[{'id': 1, 'name': 'Action'}, {'id': 17, 'name': 'Martial Arts'}, {'id': 22, 'name': 'Romance'}, {'id': 27, 'name': 'Shounen'}, {'id': 31, 'name': 'Super Power'}]",1,manga,6720,pg_13,"[{'id': 1, 'name': 'Studio Pierrot'}]",218,,,2014.0,fall,6227.0,457950.0,1107.0,850.0,32636.0,498770.0,0.9961,0.0039
12017,Tiger & Bunny Movie 2: The Rising,2014-02-08,2014-02-08,"The film will revolve around a mystery that happens on the day of the ""Justice Day"" festival that celebrates Sternbild's legendary goddess.

(Source: ANN)",7.78,914,3626,26643,10402,white,movie,finished_airing,"[{'id': 1, 'name': 'Action'}, {'id': 4, 'name': 'Comedy'}, {'id': 7, 'name': 'Mystery'}, {'id': 31, 'name': 'Super Power'}]",1,original,6050,pg_13,"[{'id': 14, 'name': 'Sunrise'}]",219,,,2014.0,winter,471.0,14748.0,231.0,181.0,11045.0,26676.0,0.9846,0.0154
19613,New Initial D Movie: Legend 1 - Kakusei,2014-08-24,2014-08-24,"One foggy morning, a black and white Toyota AE86 flies past Keisuke Takahashi's Mazda RX7 on Mount Akina, making him believe he has seen the ghost of a racer who died on the mountain. Resolving to defeat this phantom, Keisuke mobilizes the Akagi Red Suns to take on the local Akina Speed Stars racing team in an exchange race. He anticipates that the competition will lure the elusive ""Ghost of Akina"" out into the open and give him the opportunity to exact revenge for his previous defeat. 

While his friend Itsuki Takeuchi is obsessed with cars and racing, Takumi Fujiwara is not. He fails to understand the ""rush"" that racers experience and any talk of cars reminds him of the tofu deliveries he makes for his father in an old AE86. His early morning routine takes him up and down Mount Akina, where he has memorized every hairpin, brake point, and turn better than anyone else. 

When the Akagi team appears one night to challenge the Speed Stars to an exchange race, they accept the challenge only to find out that they are completely outclassed. The only way the Speed Stars can stand a chance against them is if they can get the panda-colored AE86 to join their team. With a bit of coercion, Takumi takes the wheel of the AE86 and heads off to Mount Akina to defend the pride of all racers in Akina.

[Written by MAL Rewrite]",7.77,917,3386,30344,15006,white,movie,finished_airing,"[{'id': 1, 'name': 'Action'}, {'id': 3, 'name': 'Cars'}, {'id': 42, 'name': 'Seinen'}, {'id': 30, 'name': 'Sports'}]",1,manga,3756,pg_13,"[{'id': 537, 'name': 'SANZIGEN'}, {'id': 839, 'name': 'LIDENFILMS'}]",220,,,2014.0,summer,566.0,21426.0,226.0,234.0,7909.0,30361.0,0.9848,0.0152
2397,Digimon Adventure: Bokura no War Game!,2000-03-04,2000-03-04,"This movie takes place after the Adventure series ends. It begins when a new Digimon Egg is found on the internet, and manages to penetrate into almost every computer system in Japan. When the egg hatches, it's identified as a new kind of Digimon, a Virus-type. It sustains itself by eating data from various system, and starts wreaking havok in Japan. As it consumes more and more data, it continues to evolve. And Taichi and Koushiro decide it's time to stop it.

They're off, sending Agumon and Tentomon through the internet to fight off this new enemy. But, with the Virus controlling systems like the American military, all too soon, this digital menace may become all too real. Calling in the help of Yamato and Takeru, they hope that they can stop what's already begun, and maybe save this world a second time.

(Source: AniDB)",7.77,924,2135,70125,43599,white,movie,finished_airing,"[{'id': 2, 'name': 'Adventure'}, {'id': 4, 'name': 'Comedy'}, {'id': 15, 'name': 'Kids'}, {'id': 24, 'name': 'Sci-Fi'}]",1,original,2460,pg,"[{'id': 18, 'name': 'Toei Animation'}]",221,,,2000.0,winter,653.0,63524.0,286.0,313.0,5431.0,70207.0,0.9915,0.0085
32871,Kuroko no Basket Movie 3: Winter Cup - Tobira no Mukou,2016-12-03,2016-12-03,"Third of three compilation films of the Kuroko no Basket franchise.

Rakuzan and Shutoku face off in the semi finals at the Winter Cup. Despite struggling with Akashi's Emperor Eye that sees through everything, Midorima and Takao fight back with their consecutive plays, and the whole Shutoku team bites back at Rakuzan. However, it doesn't take long before Akashi crushes all of their hopes. It is decided that the finals will be fought between Seirin and Rakuzan. Kagami immediately enters the Zone as soon as the match starts, but it is no match for Akashi. Facing an extreme difference in ability against Rakuzan, Seirin loses their hope a number of times during the match. However, Kuroko doesn't give up, and continues to strongly fight against Akashi.

(Source: Crunchyroll)",7.77,929,3275,32645,11811,white,movie,finished_airing,"[{'id': 4, 'name': 'Comedy'}, {'id': 27, 'name': 'Shounen'}, {'id': 30, 'name': 'Sports'}]",1,manga,5280,pg_13,"[{'id': 10, 'name': 'Production I.G'}]",222,,,2016.0,fall,735.0,21362.0,298.0,345.0,10092.0,32832.0,0.9804,0.0196
35678,Hibike! Euphonium Movie 3: Chikai no Finale,2019-04-19,2019-04-19,"A new year signifies a new beginning, and that seems to be the case for Kitauji High School’s concert band. Following the graduation of the third-year seniors comes the entrance of the first-year juniors. The band members put in their utmost effort in practicing for their goal—to enter nationals.

The now second-year Kumiko Oumae, along with her friends, is met with the new and quirky batch of first-years, resulting in friction and conflict between the band members. However, as time passes, their inner feelings slowly unravel, but not every conflict is as easy to solve as the other. The trust and bonds between the band members will be challenged as they push forward for their regionals.

[Written by MAL Rewrite] ",7.76,936,2539,51878,20643,white,movie,finished_airing,"[{'id': 8, 'name': 'Drama'}, {'id': 19, 'name': 'Music'}, {'id': 23, 'name': 'School'}]",1,novel,6060,pg_13,"[{'id': 2, 'name': 'Kyoto Animation'}]",223,,,2019.0,spring,1087.0,25548.0,484.0,211.0,24743.0,52073.0,0.9867,0.0133
1379,Kino no Tabi: The Beautiful World - Nanika wo Suru Tame ni - Life Goes On.,2005-02-19,2005-02-19,"After running away from the grim future that awaited her back in her home country, a young girl takes upon a new name and identity—inspired by the man who sacrificed his life to help her escape. Alongside her newfound companion, a talking motorcycle, the two find themselves a new home in the forest—where lives an elderly woman with an expertise in guns. Under the woman's care, the girl is trained in marksmanship and motorcycle handling among other various skills needed to survive.

Although the girl is happy with her current life, her guilt regarding her savior's death continues to build within herself. She still feels responsible for her savior's death, and considers the consequences of using his name as her own. In doing so, she is denying her own identity and existence by trying to replicate another person's life, instead of living her own.

Kino no Tabi: The Beautiful World - Nanika wo Suru Tame ni - Life Goes On. follows the journey of a young girl as she begins to come to terms with her new identity.

[Written by MAL Rewrite]",7.76,938,2548,51520,22769,white,movie,finished_airing,"[{'id': 2, 'name': 'Adventure'}, {'id': 8, 'name': 'Drama'}, {'id': 10, 'name': 'Fantasy'}]",1,light_novel,1785,r,"[{'id': 179, 'name': 'A.C.G.T.'}]",224,,,2005.0,winter,1060.0,31071.0,588.0,271.0,18578.0,51568.0,0.9833,0.0167
19489,Little Witch Academia: Mahoujikake no Parade,2015-10-09,2015-10-09,"You can tell witch training is not going swimmingly for the young sorceresses Akko, Lotte, and Sucy—they face expulsion for screwing up one class too many, and their only way out is if they successfully organize their academy's annual parade through a nearby town. But when they stumble upon the momentous discovery that the objective of the parade is to humiliate witches and commemorate their past subjugation, Akko decides it is time for a change: It is time to show the world how fantastic modern witches truly are! However, with the other girls struggling to keep up with Akko's grandiose ambitions, and everything from mischievous boys to slumbering giants getting in their way, maybe pulling it off will require not only all the magical prowess the pupils of Luna Nova Magical Academy can muster, but also a miracle.

[Written by MAL Rewrite]",7.76,940,1189,158084,89458,white,movie,finished_airing,"[{'id': 2, 'name': 'Adventure'}, {'id': 4, 'name': 'Comedy'}, {'id': 10, 'name': 'Fantasy'}, {'id': 23, 'name': 'School'}]",1,original,3200,pg,"[{'id': 803, 'name': 'Trigger'}]",225,,,2015.0,fall,2312.0,121832.0,973.0,518.0,32473.0,158108.0,0.9906,0.0094
1092,Mobile Suit Gundam III: Encounters in Space,1982-03-13,1982-03-13,"The One Year War comes to a close, as the Zeon forces now retreat back into space. Amuro learns much more of his Newtype abilities and tries to use them the best way he can. He's pushed to his limit as he encounters the infamous Char Aznable once again. He also falls in love with a mysterious woman named Lalah Sune, who knows the full potential of the Newtype abilities. 

The greatest battle is about to begin, as many loved ones fall to the power of war. Can the Earth Federation defeat the Principality of Zeon? Or will they fail? Can Char prove that he's the better Newtype than Amuro? They all will be answered now...

(Source: Otakufreakmk2)",7.76,942,3587,27343,15929,white,movie,finished_airing,"[{'id': 1, 'name': 'Action'}, {'id': 2, 'name': 'Adventure'}, {'id': 8, 'name': 'Drama'}, {'id': 18, 'name': 'Mecha'}, {'id': 38, 'name': 'Military'}, {'id': 24, 'name': 'Sci-Fi'}, {'id': 29, 'name': 'Space'}]",1,original,8419,pg_13,"[{'id': 14, 'name': 'Sunrise'}]",226,,,1982.0,winter,456.0,21006.0,226.0,216.0,5494.0,27398.0,0.9839,0.0161
11001,Toshokan Sensou: Kakumei no Tsubasa,2012-06-16,2012-06-16,"Kasahara Iku and Dojo Atsushi receive an emergency recall in the middle of their date as Japan is rocked by a terror attack. Their new duty is a protection detail assigned to Touma Kurato, an author. Meanwhile, the relationship between Librarians and the Media Purity Committee is also worsening. ",7.76,950,3961,22063,7752,white,movie,finished_airing,"[{'id': 1, 'name': 'Action'}, {'id': 4, 'name': 'Comedy'}, {'id': 38, 'name': 'Military'}, {'id': 22, 'name': 'Romance'}]",1,novel,6300,pg_13,"[{'id': 10, 'name': 'Production I.G'}]",227,,,2012.0,spring,714.0,10372.0,325.0,263.0,10396.0,22070.0,0.9734,0.0266
2753,Ushiro no Shoumen Daare,1991-03-09,1991-03-09,"Kayoko is a young girl in 1940, just starting first grade. She's a bit of a crybaby, which is no secret to those around her. She loves playing with friends and singing cute schoolyard chants, and occasionally having fun with her three older brothers. Her mother is pregnant, and so she looks forward to being a big sister, only partially understanding the responsibility that might bring. Meanwhile, the war effort is growing, and it`s only the natural thing to do to be patriotic and support the country...

Kayoko goes so far as to contribute her favorite dolly, whose materials could help build explosives. Time passes, and as she grows older, Kayoko sees how the war has affected her life and those around her. Nothing can prepare her for 1945, however, and the bleak times that are soon to come. Based on original creator Kayoko Ebina's real life experience during World War 2 on Showa era.

(Source: ANN)",7.76,951,5274,10917,3215,white,movie,finished_airing,"[{'id': 8, 'name': 'Drama'}, {'id': 13, 'name': 'Historical'}]",1,novel,5400,g,"[{'id': 68, 'name': 'Mushi Production'}]",228,,,1991.0,winter,278.0,4276.0,161.0,137.0,6083.0,10935.0,0.9727,0.0273
29829,Tamayura: Sotsugyou Shashin Part 2 - Hibiki,2015-08-29,2015-08-29,The second movie of a four-part finale of Tamayura.,7.75,959,5719,8958,2805,white,movie,finished_airing,"[{'id': 4, 'name': 'Comedy'}, {'id': 8, 'name': 'Drama'}, {'id': 36, 'name': 'Slice of Life'}]",1,original,3120,g,"[{'id': 333, 'name': 'TYO Animations'}]",229,,,2015.0,summer,326.0,3778.0,196.0,145.0,4537.0,8982.0,0.962,0.038
35198,Free! Take Your Marks,2017-10-28,2017-10-28,"Taking place between the events of Free!: Eternal Summer and Free!: Dive to the Future, Free!: Take Your Marks plays out the graduated seniors' last summer through four different stories before they set sail for the future.

Unmei no Choice! (Destined Choice!) follows Haruka Nanase and Makoto Tachibana searching for a new apartment for Haruka as he settles into Tokyo. 

Hitou no Cooling Down! (Cooling Down at the Secret Hot Spring!) sees Aiichiro Nitori choose a graduation gift for Rin Matsuoka and Sousuke Yamazaki, while Momotaro Mikoshiba wins tickets to the Anago Hot Springs. Hoping for a trip together, Aiichiro and Momotaro invite Rin and Sousuke. 

Kessoku no Batafurai! (United Butterfly!) shows Rei Ryugazaki, Nagisa Hazuki, and Gou Matsuoka creating a recruitment video to attract new club members for the next school year. 

Tabidachi no Etanaru Buru! (Departing Eternal Blue!) looks into the Iwatobi and Samezuka swim teams' plans for Rin's surprise going-away party, as he will be departing for Australia soon. 

[Written by MAL Rewrite]",7.75,967,2186,67806,24126,white,movie,finished_airing,"[{'id': 23, 'name': 'School'}, {'id': 36, 'name': 'Slice of Life'}, {'id': 30, 'name': 'Sports'}]",1,original,6480,pg_13,"[{'id': 2, 'name': 'Kyoto Animation'}]",230,,,2017.0,fall,1448.0,37566.0,787.0,481.0,27855.0,68137.0,0.9814,0.0186
