id,title,main_picture,start_date,end_date,synopsis,mean,rank,popularity,num_list_users,num_scoring_users,nsfw,created_at,updated_at,media_type,status,genres,num_episodes,start_season,broadcast,source,average_episode_duration,rating,background,studios,statistics,bypopularity_ranking
23283,Zankyou no Terror,"{'medium': 'https://api-cdn.myanimelist.net/images/anime/1417/117422.jpg', 'large': 'https://api-cdn.myanimelist.net/images/anime/1417/117422l.jpg'}",2014-07-11,2014-09-26,"Painted in red, the word ""VON"" is all that is left behind after a terrorist attack on a nuclear facility in Japan. The government is shattered by their inability to act, and the police are left frantically searching for ways to crack down the perpetrators. The public are clueless—until, six months later, a strange video makes its way onto the internet. In it, two teenage boys who identify themselves only as ""Sphinx"" directly challenge the police, threatening to cause destruction and mayhem across Tokyo. Unable to stop the mass panic quickly spreading through the city and desperate for any leads in their investigation, the police struggle to act effectively against these terrorists, with Detective Kenjirou Shibazaki caught in the middle of it all.

Zankyou no Terror tells the story of Nine and Twelve, the two boys behind the masked figures of Sphinx. They should not exist, yet they stand strong in a world of deception and secrets while they make the city fall around them, all in the hopes of burying their own tragic truth.

[Written by MAL Rewrite]",8.11,431.0,112,1001380,530852,white,2014-03-21T13:55:48+00:00,2022-03-22T13:22:07+00:00,tv,finished_airing,"[{'id': 7, 'name': 'Mystery'}, {'id': 40, 'name': 'Psychological'}, {'id': 41, 'name': 'Suspense'}]",11,"{'year': 2014, 'season': 'summer'}","{'day_of_the_week': 'friday', 'start_time': '00:50'}",original,1370,r,"Episodes 1 and 2 were previewed at a screening in Los Angeles at Anime Expo on July 5, 2014. Regular broadcasting began on July 11, 2014.

In an interview with Otaku USA Magazine director Shinichirou Watanabe stated that the music of Icelandic band Sigur Rós gave him visual images that inspired the series and its soundtrack. He also states that the team went to Iceland to record the music.","[{'id': 569, 'name': 'MAPPA'}]","{'status': {'watching': '44383', 'completed': '655387', 'on_hold': '23094', 'dropped': '19652', 'plan_to_watch': '259078'}, 'num_list_users': 1001594}",112
32935,Haikyuu!!: Karasuno Koukou vs. Shiratorizawa Gakuen Koukou,"{'medium': 'https://api-cdn.myanimelist.net/images/anime/7/81992.jpg', 'large': 'https://api-cdn.myanimelist.net/images/anime/7/81992l.jpg'}",2016-10-08,2016-12-10,"After the victory against Aoba Jousai High, Karasuno High School, once called “a fallen powerhouse, a crow that can’t fly,” has finally reached the climax of the heated Spring tournament. Now, to advance to nationals, the Karasuno team has to defeat the powerhouse Shiratorizawa Academy. Karasuno’s greatest hurdle is their adversary’s ace, Wakatoshi Ushijima, the number one player in the Miyagi Prefecture, and one of the country’s top three aces.

Only the strongest team will make it to the national tournament. Since this match is the third-year players’ last chance to qualify for nationals, Karasuno has to use everything they learned during the training camp and prior matches to attain victory. Filled with restlessness and excitement, both teams are determined to come out on top in the third season of Haikyuu!!.

[Written by MAL Rewrite] ",8.8,30.0,113,1000925,659591,white,2016-03-16T14:25:47+00:00,2022-03-22T12:03:52+00:00,tv,finished_airing,"[{'id': 4, 'name': 'Comedy'}, {'id': 8, 'name': 'Drama'}, {'id': 23, 'name': 'School'}, {'id': 27, 'name': 'Shounen'}, {'id': 30, 'name': 'Sports'}]",10,"{'year': 2016, 'season': 'fall'}","{'day_of_the_week': 'saturday', 'start_time': '01:55'}",manga,1440,pg_13,,"[{'id': 10, 'name': 'Production I.G'}]","{'status': {'watching': '34201', 'completed': '870982', 'on_hold': '7221', 'dropped': '4588', 'plan_to_watch': '88146'}, 'num_list_users': 1005138}",113
32282,Shokugeki no Souma: Ni no Sara,"{'medium': 'https://api-cdn.myanimelist.net/images/anime/8/79353.jpg', 'large': 'https://api-cdn.myanimelist.net/images/anime/8/79353l.jpg'}",2016-07-02,2016-09-24,"The qualifiers of the Autumn Elections are now over, and only eight talented chefs remain. Now, they face off in one-on-one food wars, each with their own unique themes. Met with both new judges and new opponents all with their own specialties, Souma must stay on his toes if he hopes to make it to the top of both the Autumn Elections and Tootsuki Culinary Academy.

[Written by MAL Rewrite]",8.12,409.0,114,995883,629524,white,2015-12-10T09:59:33+00:00,2022-03-22T13:36:17+00:00,tv,finished_airing,"[{'id': 9, 'name': 'Ecchi'}, {'id': 47, 'name': 'Gourmet'}, {'id': 23, 'name': 'School'}, {'id': 27, 'name': 'Shounen'}]",13,"{'year': 2016, 'season': 'summer'}","{'day_of_the_week': 'saturday', 'start_time': '22:00'}",manga,1460,pg_13,,"[{'id': 7, 'name': 'J.C.Staff'}]","{'status': {'watching': '40918', 'completed': '847575', 'on_hold': '11600', 'dropped': '9628', 'plan_to_watch': '89317'}, 'num_list_users': 999038}",114
853,Ouran Koukou Host Club,"{'medium': 'https://api-cdn.myanimelist.net/images/anime/2/71992.jpg', 'large': 'https://api-cdn.myanimelist.net/images/anime/2/71992l.jpg'}",2006-04-05,2006-09-27,"Haruhi Fujioka is a studious girl who has recently enrolled at the prestigious Ouran Academy. One day, while looking for a quiet and peaceful place to study, she stumbles across a seemingly unused music room. Upon entering, Haruhi is welcomed by the members of the well-known Host Club: a club in which attractive boys amuse girls from across the entire school. However, when Tamaki Suou—the founder and president of the club—startles the bright scholarship student, she accidentally breaks an expensive vase.

With repayment looking difficult for Haruhi, the Host Club members come up with the perfect solution to the girl's problem: work for the club and ultimately become a Host herself! Mistaken for a boy by her peers, Haruhi has to entertain various female students while coping with her fellow Hosts' extravagant personalities.

[Written by MAL Rewrite]
",8.17,355.0,115,989706,588247,white,2006-04-08T17:29:29+00:00,2022-03-22T12:36:50+00:00,tv,finished_airing,"[{'id': 4, 'name': 'Comedy'}, {'id': 22, 'name': 'Romance'}, {'id': 23, 'name': 'School'}, {'id': 25, 'name': 'Shoujo'}]",26,"{'year': 2006, 'season': 'spring'}","{'day_of_the_week': 'wednesday', 'start_time': '00:50'}",manga,1401,pg_13,"In addition to this anime and the source manga, Ouran Koukou Host Club also received a visual novel adaptation for PlayStation 2 in 2007 and Nintendo DS in 2009. Furthermore, it spawned a live-action TV series and film that were released in Japan in 2011 and 2012, respectively.
","[{'id': 4, 'name': 'Bones'}]","{'status': {'watching': '45485', 'completed': '754349', 'on_hold': '32051', 'dropped': '30034', 'plan_to_watch': '129145'}, 'num_list_users': 991064}",115
20899,JoJo no Kimyou na Bouken Part 3: Stardust Crusaders,"{'medium': 'https://api-cdn.myanimelist.net/images/anime/11/55267.jpg', 'large': 'https://api-cdn.myanimelist.net/images/anime/11/55267l.jpg'}",2014-04-05,2014-09-13,"Years after an ancient evil was salvaged from the depths of the sea, Joutarou Kuujou sits peacefully within a Japanese jail cell. He's committed no crime yet demands he not be released, believing he's been possessed by an evil spirit capable of harming those around him. Concerned for her son, Holly Kuujou asks her father, Joseph Joestar, to convince Joutarou to leave the prison. Joseph informs his grandson that the ""evil spirit"" is in fact something called a ""Stand,"" the physical manifestation of one's fighting spirit which can adopt a variety of deadly forms. After a fiery brawl with Joseph's friend Mohammed Avdol, Joutarou is forced out of his cell and begins learning how to control the power of his Stand.

However, when a Stand awakens within Holly and threatens to consume her in 50 days, Joutarou, his grandfather, and their allies must seek out and destroy the immortal vampire responsible for her condition. They must travel halfway across the world to Cairo, Egypt and along the way, do battle with ferocious Stand users set on thwarting them. If Joutarou and his allies fail in their mission, humanity is destined for a grim fate.

[Written by MAL Rewrite]",8.1,440.0,116,983791,688243,white,2013-10-15T17:49:30+00:00,2022-03-22T13:37:50+00:00,tv,finished_airing,"[{'id': 1, 'name': 'Action'}, {'id': 2, 'name': 'Adventure'}, {'id': 8, 'name': 'Drama'}, {'id': 27, 'name': 'Shounen'}, {'id': 37, 'name': 'Supernatural'}]",24,"{'year': 2014, 'season': 'spring'}","{'day_of_the_week': 'saturday', 'start_time': '00:30'}",manga,1440,r,"JoJo no Kimyou na Bouken: Stardust Crusaders, as well as its second season, is a full adaptation of the third part of the JoJo no Kimyou na Bouken manga series. The first season covers the first 69 chapters of the manga. As with the prior season, the opening theme animations were produced by the studio Kamikaze Douga (神風動画).","[{'id': 287, 'name': 'David Production'}]","{'status': {'watching': '46118', 'completed': '846919', 'on_hold': '15271', 'dropped': '9080', 'plan_to_watch': '66978'}, 'num_list_users': 984366}",116
11741,Fate/Zero 2nd Season,"{'medium': 'https://api-cdn.myanimelist.net/images/anime/1522/117645.jpg', 'large': 'https://api-cdn.myanimelist.net/images/anime/1522/117645l.jpg'}",2012-04-08,2012-06-24,"As the Fourth Holy Grail War rages on with no clear victor in sight, the remaining Servants and their Masters are called upon by Church supervisor Risei Kotomine, in order to band together and confront an impending threat that could unravel the Grail War and bring about the destruction of Fuyuki City. The uneasy truce soon collapses as Masters demonstrate that they will do anything in their power, no matter how despicable, to win.

Seeds of doubt are sown between Kiritsugu Emiya and Saber, his Servant, as their conflicting ideologies on heroism and chivalry clash. Meanwhile, an ominous bond forms between Kirei Kotomine, who still seeks to find his purpose in life, and one of the remaining Servants. As the countdown to the end of the war reaches zero, the cost of winning begins to blur the line between victory and defeat.

[Written by MAL Rewrite]",8.57,83.0,117,981218,620373,white,2011-10-08T08:44:50+00:00,2022-03-22T12:38:02+00:00,tv,finished_airing,"[{'id': 1, 'name': 'Action'}, {'id': 10, 'name': 'Fantasy'}, {'id': 37, 'name': 'Supernatural'}]",12,"{'year': 2012, 'season': 'spring'}","{'day_of_the_week': 'sunday', 'start_time': '00:00'}",light_novel,1440,r,,"[{'id': 43, 'name': 'ufotable'}]","{'status': {'watching': '26315', 'completed': '790257', 'on_hold': '9992', 'dropped': '5720', 'plan_to_watch': '149628'}, 'num_list_users': 981912}",117
36511,Tokyo Ghoul:re,"{'medium': 'https://api-cdn.myanimelist.net/images/anime/1063/95086.jpg', 'large': 'https://api-cdn.myanimelist.net/images/anime/1063/95086l.jpg'}",2018-04-03,2018-06-19,"Two years have passed since the CCG's raid on Anteiku. Although the atmosphere in Tokyo has changed drastically due to the increased influence of the CCG, ghouls continue to pose a problem as they have begun taking caution, especially the terrorist organization Aogiri Tree, who acknowledge the CCG's growing threat to their existence.

The creation of a special team, known as the Quinx Squad, may provide the CCG with the push they need to exterminate Tokyo's unwanted residents. As humans who have undergone surgery in order to make use of the special abilities of ghouls, they participate in operations to eradicate the dangerous creatures. The leader of this group, Haise Sasaki, is a half-ghoul, half-human who has been trained by famed special class investigator, Kishou Arima. However, there's more to this young man than meets the eye, as unknown memories claw at his mind, slowly reminding him of the person he used to be.

[Written by MAL Rewrite]",6.39,6789.0,118,972854,557758,white,2017-10-05T10:45:33+00:00,2022-03-22T12:28:25+00:00,tv,finished_airing,"[{'id': 1, 'name': 'Action'}, {'id': 8, 'name': 'Drama'}, {'id': 14, 'name': 'Horror'}, {'id': 7, 'name': 'Mystery'}, {'id': 40, 'name': 'Psychological'}, {'id': 42, 'name': 'Seinen'}, {'id': 37, 'name': 'Supernatural'}]",12,"{'year': 2018, 'season': 'spring'}","{'day_of_the_week': 'tuesday', 'start_time': '23:00'}",manga,1440,r,,"[{'id': 1, 'name': 'Studio Pierrot'}, {'id': 1129, 'name': 'Pierrot Plus'}]","{'status': {'watching': '64247', 'completed': '718592', 'on_hold': '19246', 'dropped': '52448', 'plan_to_watch': '122338'}, 'num_list_users': 976871}",118
34577,Nanatsu no Taizai: Imashime no Fukkatsu,"{'medium': 'https://api-cdn.myanimelist.net/images/anime/11/90089.jpg', 'large': 'https://api-cdn.myanimelist.net/images/anime/11/90089l.jpg'}",2018-01-13,2018-06-30,"The fierce battle between Meliodas, the captain of the Seven Deadly Sins, and the Great Holy Knight Hendrickson has devastating consequences. Armed with the fragments necessary for the revival of the Demon Clan, Hendrickson breaks the seal, allowing the Commandments to escape, all of whom are mighty warriors working directly under the Demon King himself. Through a mysterious connection, Meliodas instantly identifies them; likewise, the 10 Commandments, too, seem to sense his presence.

As the demons leave a path of destruction in their wake, the Seven Deadly Sins must find a way to stop them before the Demon Clan drowns Britannia in blood and terror.

[Written by MAL Rewrite]",7.65,1185.0,119,970301,592941,white,2016-12-18T13:42:34+00:00,2022-03-22T12:04:07+00:00,tv,finished_airing,"[{'id': 1, 'name': 'Action'}, {'id': 2, 'name': 'Adventure'}, {'id': 10, 'name': 'Fantasy'}, {'id': 27, 'name': 'Shounen'}, {'id': 37, 'name': 'Supernatural'}]",24,"{'year': 2018, 'season': 'winter'}","{'day_of_the_week': 'saturday', 'start_time': '06:30'}",manga,1467,pg_13,,"[{'id': 56, 'name': 'A-1 Pictures'}]","{'status': {'watching': '61702', 'completed': '794187', 'on_hold': '11931', 'dropped': '15852', 'plan_to_watch': '89792'}, 'num_list_users': 973464}",119
37520,Dororo,"{'medium': 'https://api-cdn.myanimelist.net/images/anime/1879/100467.jpg', 'large': 'https://api-cdn.myanimelist.net/images/anime/1879/100467l.jpg'}",2019-01-07,2019-06-24,"The greedy samurai lord Daigo Kagemitsu's land is dying, and he would do anything for power, even renounce Buddha and make a pact with demons. His prayers are answered by 12 demons who grant him the power he desires by aiding his prefecture's growth, but at a price. When Kagemitsu's first son is born, the boy has no limbs, no nose, no eyes, no ears, nor even skin—yet still, he lives.

This child is disposed of in a river and forgotten. But as luck would have it, he is saved by a medicine man who provides him with prosthetics and weapons, allowing for him to survive and fend for himself. The boy lives and grows, and although he cannot see, hear, or feel anything, he must defeat the demons that took him as sacrifice. With the death of each one, he regains a part of himself that is rightfully his. For many years he wanders alone, until one day an orphan boy, Dororo, befriends him. The unlikely pair of castaways now fight for their survival and humanity in an unforgiving, demon-infested world.

[Written by MAL Rewrite]",8.23,279.0,120,966502,472548,white,2018-03-19T13:16:46+00:00,2022-03-22T13:05:16+00:00,tv,finished_airing,"[{'id': 1, 'name': 'Action'}, {'id': 2, 'name': 'Adventure'}, {'id': 6, 'name': 'Demons'}, {'id': 13, 'name': 'Historical'}, {'id': 21, 'name': 'Samurai'}, {'id': 27, 'name': 'Shounen'}, {'id': 37, 'name': 'Supernatural'}]",24,"{'year': 2019, 'season': 'winter'}","{'day_of_the_week': 'monday', 'start_time': '22:30'}",manga,1440,r,,"[{'id': 200, 'name': 'Tezuka Productions'}, {'id': 569, 'name': 'MAPPA'}]","{'status': {'watching': '110776', 'completed': '551340', 'on_hold': '44086', 'dropped': '31801', 'plan_to_watch': '232548'}, 'num_list_users': 970551}",120
42897,Horimiya,"{'medium': 'https://api-cdn.myanimelist.net/images/anime/1695/111486.jpg', 'large': 'https://api-cdn.myanimelist.net/images/anime/1695/111486l.jpg'}",2021-01-10,2021-04-04,"On the surface, the thought of Kyouko Hori and Izumi Miyamura getting along would be the last thing in people's minds. After all, Hori has a perfect combination of beauty and brains, while Miyamura appears meek and distant to his fellow classmates. However, a fateful meeting between the two lays both of their hidden selves bare. Even though she is popular at school, Hori has little time to socialize with her friends due to housework. On the other hand, Miyamura lives under the noses of his peers, his body bearing secret tattoos and piercings that make him look like a gentle delinquent.

Having opposite personalities yet sharing odd similarities, the two quickly become friends and often spend time together in Hori's home. As they both emerge from their shells, they share with each other a side of themselves concealed from the outside world.

[Written by MAL Rewrite]",8.21,304.0,121,961580,543902,white,2020-09-16T10:56:10+00:00,2022-03-22T13:45:58+00:00,tv,finished_airing,"[{'id': 4, 'name': 'Comedy'}, {'id': 22, 'name': 'Romance'}, {'id': 23, 'name': 'School'}, {'id': 27, 'name': 'Shounen'}, {'id': 36, 'name': 'Slice of Life'}]",13,"{'year': 2021, 'season': 'winter'}","{'day_of_the_week': 'sunday', 'start_time': '00:30'}",manga,1432,pg_13,,"[{'id': 1835, 'name': 'CloverWorks'}]","{'status': {'watching': '140370', 'completed': '620232', 'on_hold': '19109', 'dropped': '19722', 'plan_to_watch': '166165'}, 'num_list_users': 965598}",121
14227,Tonari no Kaibutsu-kun,"{'medium': 'https://api-cdn.myanimelist.net/images/anime/4/39779.jpg', 'large': 'https://api-cdn.myanimelist.net/images/anime/4/39779l.jpg'}",2012-10-02,2012-12-25,"Shizuku Mizutani is apathetic toward her classmates, only caring about her grades. However, her cold view of life begins to change when she meets Haru Yoshida, a violent troublemaker who stopped attending class after getting into a fight early in the school year. He is not much different from her, though—he too understands little about human nature and does not have any friends. Much to Shizuku's surprise, he proclaims that she will be his friend and immediately confesses his feelings toward her upon meeting her.
 
Because of her lack of friends and social interaction, Shizuku has a hard time understanding her relationship with Haru. But slowly, their friendship begins to progress, and she discovers that there is more to Haru than violence. She begins to  develop feelings for him, but is unsure what kind of emotions she is experiencing. Together, Shizuku and Haru explore the true nature of their relationship and emotions.

[Written by MAL Rewrite]",7.5,1656.0,122,938123,526302,white,2012-05-24T20:48:31+00:00,2022-03-22T13:45:39+00:00,tv,finished_airing,"[{'id': 4, 'name': 'Comedy'}, {'id': 22, 'name': 'Romance'}, {'id': 23, 'name': 'School'}, {'id': 25, 'name': 'Shoujo'}, {'id': 36, 'name': 'Slice of Life'}]",13,"{'year': 2012, 'season': 'fall'}",{'day_of_the_week': 'tuesday'},manga,1462,pg_13,,"[{'id': 112, 'name': ""Brain's Base""}]","{'status': {'watching': '40727', 'completed': '696033', 'on_hold': '22631', 'dropped': '21346', 'plan_to_watch': '158022'}, 'num_list_users': 938759}",122
5680,K-On!,"{'medium': 'https://api-cdn.myanimelist.net/images/anime/10/76120.jpg', 'large': 'https://api-cdn.myanimelist.net/images/anime/10/76120l.jpg'}",2009-04-03,2009-06-26,"A fresh high school year always means much to come, and one of those things is joining a club. Being in a dilemma about which club to join, Yui Hirasawa stumbles upon and applies for the Light Music Club, which she misinterprets to be about playing simple instruments, such as castanets. Unable to play an instrument, she decides to visit to apologize and quit.

Meanwhile, the Light Music Club faces disbandment due to a lack of members. This causes the club members to offer anything, from food to slacking off during club time, in order to convince Yui to join. Despite their efforts, Yui insists on leaving due to her lack of musical experience. As a last resort, they play a piece for Yui, which sparks her fiery passion and finally convinces her to join the club.

From then onward, it's just plain messing around with bits and pieces of practice. The members of the Light Music Club are ready to make their time together a delightful one!

[Written by MAL Rewrite]",7.85,783.0,123,929998,496689,white,2008-12-06T18:09:30+00:00,2022-03-22T12:44:00+00:00,tv,finished_airing,"[{'id': 4, 'name': 'Comedy'}, {'id': 19, 'name': 'Music'}, {'id': 23, 'name': 'School'}, {'id': 36, 'name': 'Slice of Life'}]",13,"{'year': 2009, 'season': 'spring'}","{'day_of_the_week': 'friday', 'start_time': '01:59'}",4_koma_manga,1469,pg_13,The series received a Best TV Animation Award at the 2010 Tokyo International Anime Fair.,"[{'id': 2, 'name': 'Kyoto Animation'}]","{'status': {'watching': '44650', 'completed': '613283', 'on_hold': '29409', 'dropped': '29626', 'plan_to_watch': '213971'}, 'num_list_users': 930939}",123
20785,Mahouka Koukou no Rettousei,"{'medium': 'https://api-cdn.myanimelist.net/images/anime/11/61039.jpg', 'large': 'https://api-cdn.myanimelist.net/images/anime/11/61039l.jpg'}",2014-04-06,2014-09-28,"In the dawn of the 21st century, magic, long thought to be folklore and fairy tales, has become a systematized technology and is taught as a technical skill. In First High School, the institution for magicians, students are segregated into two groups based on their entrance exam scores: ""Blooms,"" those who receive high scores, are assigned to the First Course, while ""Weeds"" are reserve students assigned to the Second Course.

Mahouka Koukou no Rettousei follows the siblings, Tatsuya and Miyuki Shiba, who are enrolled in First High School. Upon taking the exam, the prodigious Miyuki is placed in the First Course, while Tatsuya is relegated to the Second Course. Though his practical test scores and status as a ""Weed"" show him to be magically inept, he possesses extraordinary technical knowledge, physical combat capabilities, and unique magic techniques—making Tatsuya the irregular at a magical high school.

[Written by MAL Rewrite]",7.44,1849.0,124,924952,498016,white,2013-10-06T11:31:03+00:00,2022-03-22T11:46:48+00:00,tv,finished_airing,"[{'id': 1, 'name': 'Action'}, {'id': 22, 'name': 'Romance'}, {'id': 23, 'name': 'School'}, {'id': 24, 'name': 'Sci-Fi'}, {'id': 37, 'name': 'Supernatural'}]",26,"{'year': 2014, 'season': 'spring'}","{'day_of_the_week': 'sunday', 'start_time': '00:30'}",light_novel,1420,pg_13,The anime closely follows the events of the first seven light novels (excluding the fifth novel: Summer Holiday Arc + 1). There are three video game adaptations of the series.,"[{'id': 11, 'name': 'Madhouse'}]","{'status': {'watching': '54894', 'completed': '635753', 'on_hold': '28785', 'dropped': '55711', 'plan_to_watch': '150124'}, 'num_list_users': 925267}",124
35120,Devilman: Crybaby,"{'medium': 'https://api-cdn.myanimelist.net/images/anime/2/89973.jpg', 'large': 'https://api-cdn.myanimelist.net/images/anime/2/89973l.jpg'}",2018-01-05,2018-01-05,"Devils cannot take form without a living host. However, if the will of an individual is strong enough, they can overcome the demon and make its power their own, becoming a Devilman.

Weak and unassuming, Akira Fudou has always had a bleeding heart. So when his childhood friend Ryou Asuka asks for his help in uncovering devils, Akira accepts without hesitation. However, to Akira's surprise, the place they go to is Sabbath: an immoral party of debauchery and degeneracy. Amidst bloodshed and death, demons possess the partiers, turning their bodies into grotesque monsters, and begin wreaking havoc. In a reckless attempt to save his best friend, Akira unwittingly merges with the devil Amon and becomes a Devilman, gaining the power to defeat the remaining demons.

Though it grants him great power, this new partnership awakens an insatiable and primeval part of Akira. Having the body of a devil but the same crybaby heart, Akira works alongside Ryou, destroying those that harm humanity and his loved ones.

[Written by MAL Rewrite]",7.78,891.0,125,923459,556858,white,2017-03-15T21:40:08+00:00,2022-03-22T12:33:12+00:00,ona,finished_airing,"[{'id': 1, 'name': 'Action'}, {'id': 5, 'name': 'Avant Garde'}, {'id': 6, 'name': 'Demons'}, {'id': 14, 'name': 'Horror'}, {'id': 37, 'name': 'Supernatural'}]",10,"{'year': 2018, 'season': 'winter'}",,manga,1522,r+,,"[{'id': 1591, 'name': 'Science SARU'}]","{'status': {'watching': '40267', 'completed': '680262', 'on_hold': '19675', 'dropped': '27486', 'plan_to_watch': '160037'}, 'num_list_users': 927727}",125
