id,title,start_date,end_date,synopsis,mean,rank,popularity,num_list_users,num_scoring_users,nsfw,media_type,status,genres,num_episodes,source,average_episode_duration,rating,studios,movie_ranking,broadcast_day_of_the_week,broadcast_start_time,start_season_year,start_season_season,statistics_watching,statistics_completed,statistics_on_hold,statistics_dropped,statistics_plan_to_watch,statistics_num_list_users,positive_viewership_fraction,negative_viewership_fraction
9760,Hoshi wo Ou Kodomo,2011-05-07,2011-05-07,"If you could turn all your memories into a song, what would it resemble?

Between being an exceptional student and taking care of the house alone during her mother's absence, Asuna Watase's only distraction is listening to her old crystal radio in her secret mountain hideout. One day, she accidentally tunes to a mysterious and melancholic melody, different from anything she has ever heard before. Soon after, an enigmatic boy named Shun saves her from a dangerous creature, unknowingly dragging Asuna on a long journey to a long lost land bound to surpass her very imagination, turning her once melodic life into an intricate requiem.

[Written by MAL Rewrite]",7.54,1516,1000,188344,85848,white,movie,finished_airing,"[{'id': 2, 'name': 'Adventure'}, {'id': 10, 'name': 'Fantasy'}, {'id': 22, 'name': 'Romance'}]",1,original,6960,pg_13,"[{'id': 291, 'name': 'CoMix Wave Films'}]",358,,,2011.0,spring,4288.0,110335.0,1944.0,1002.0,70941.0,188510.0,0.9844,0.0156
522,Metropolis,2001-05-26,2001-05-26,"In the great city of Metropolis, severe community structures and prejudice dominate a world where humans and robots live together. Unrest and violence increase with each new day.

Searching for the scientist Dr. Laughton, suspected to violate human rights by trading organs, the Japanese detective Shunsaku Ban and his nephew Kenichi arrive at Metropolis. In the scientist's laboratory, Kenichi discovers a girl without any memory of her past life. He decides to help her, so they run away together. His uncle follows him and penetrates the dark secrets of the city to find Duke Red, the man ruling from the shadows. Meanwhile, Kenichi desperately tries to protect the mysterious girl from the people hunting her. However, Duke Red and his adoptive son have their own deep reasons for chasing the girl. These reasons are connected to her true identity and the struggle for the domination of Metropolis...

[Written by MAL Rewrite]",7.53,1539,1813,90774,39317,white,movie,finished_airing,"[{'id': 2, 'name': 'Adventure'}, {'id': 8, 'name': 'Drama'}, {'id': 39, 'name': 'Police'}, {'id': 22, 'name': 'Romance'}, {'id': 24, 'name': 'Sci-Fi'}, {'id': 27, 'name': 'Shounen'}]",1,manga,6540,pg_13,"[{'id': 11, 'name': 'Madhouse'}]",359,,,2001.0,spring,1816.0,51347.0,899.0,537.0,36311.0,90910.0,0.9842,0.0158
10500,Ojiisan no Lamp,2011-03-05,2011-03-05,"When a young boy named Tooichi stumbles upon an old lamp in his grandfather's shed, he mistakes it for a toy and takes it outside to play. When his grandfather discovers this, he reprimands the boy and begins recounting the story behind the artifact—of how a small, traditional Japanese town became Westernized. 

In his youth, Tooichi's grandfather, Minosuke, made a living by doing errands and chores for the townspeople. After one errand takes him to a nearby town, he witnesses Western lamps—a technology unfamiliar to him—light up the streets, igniting a spark in the young boy. From that moment on, lamps became Minosuke's passion and profession, changing his and the townspeople's lives forever.

[Written by MAL Rewrite]",7.53,1541,4229,18982,9320,white,movie,finished_airing,"[{'id': 8, 'name': 'Drama'}, {'id': 13, 'name': 'Historical'}]",1,original,1466,g,"[{'id': 94, 'name': 'Telecom Animation Film'}]",360,,,2011.0,winter,298.0,11719.0,192.0,100.0,6685.0,18994.0,0.9846,0.0154
37807,Princess Principal: Crown Handler Movie 1,2021-02-11,2021-02-11,"The film is set in London at the end of the 19th century and after the attempted assassination of the Imperial princess in the television anime. The Empire is increasing counter-spy actions in the wake of the incident, and finds Control, the Commonwealth group in charge of covert operations against the Empire, at unease and suspecting its spy within the royal family as a double agent. Control assigns their spy ring Dove with a new mission to extract a secondhand bookstore owner and deliver him to Commonwealth hands. Ange, Dorothy, and Chise successfully spring the bookstore owner from an Imperial prison. Control also assigns Dove to make contact with Bishop, their spy within the royal family, to ascertain their loyalties.

(Source: ANN)",7.53,1542,3149,35027,4840,white,movie,finished_airing,"[{'id': 1, 'name': 'Action'}, {'id': 13, 'name': 'Historical'}, {'id': 7, 'name': 'Mystery'}]",1,original,3180,r,"[{'id': 60, 'name': 'Actas'}]",361,,,2021.0,winter,672.0,6397.0,343.0,110.0,27620.0,35142.0,0.9871,0.0129
1861,Slam Dunk: Zenkoku Seiha Da! - Sakuragi Hanamichi,1994-08-20,1994-08-20,"Set during the Inter High Championships, Shohoku take on Tsukubu, one of this year's dark horses. It's a clash of acquaintances as Anzai will face his former student which is now the coach of Tsukubu, while Akagi & Kogure meet Godai their former classmate and Tsukubu's captain. Finally Sakuragi is irked by the presence of Nango, Tsukubu's center, who vies for Haruko's attention.

(Source: ANN)",7.53,1545,4719,14450,7306,white,movie,finished_airing,"[{'id': 4, 'name': 'Comedy'}, {'id': 8, 'name': 'Drama'}, {'id': 23, 'name': 'School'}, {'id': 27, 'name': 'Shounen'}, {'id': 36, 'name': 'Slice of Life'}, {'id': 30, 'name': 'Sports'}]",1,manga,2700,pg_13,"[{'id': 18, 'name': 'Toei Animation'}]",362,,,1994.0,summer,222.0,10498.0,172.0,156.0,3426.0,14474.0,0.9773,0.0227
30778,Fairy Tail Movie 2: Dragon Cry,2017-05-06,2017-05-06,"Dragon Cry is a magical artifact of deadly power, formed into a staff by the fury and despair of dragons long gone. Now, this power has been stolen from the hands of the Fiore kingdom by the nefarious traitor Zash Caine, who flees with it to the small island nation of Stella. Frightened that the power has fallen into the wrong hands, the King of Fiore hastily sends Fairy Tail to retrieve the staff. But this task proves frightening as a shadowy secret lies in the heart of the kingdom of Stella. Dragon Cry follows their story as they muster up all their strength to recover the stolen staff and save both kingdoms.
 
[Written by MAL Rewrite]",7.53,1556,1151,162892,82409,white,movie,finished_airing,"[{'id': 1, 'name': 'Action'}, {'id': 2, 'name': 'Adventure'}, {'id': 4, 'name': 'Comedy'}, {'id': 10, 'name': 'Fantasy'}, {'id': 27, 'name': 'Shounen'}]",1,manga,5040,pg_13,"[{'id': 56, 'name': 'A-1 Pictures'}]",363,,,2017.0,spring,2650.0,121585.0,1027.0,637.0,37583.0,163482.0,0.9898,0.0102
6152,Final Fantasy VII: Advent Children - Venice Film Festival Footage,2005-09-14,2005-09-14,Advent Children Special Edition is the 25 minute version of the movie which was shown at the 62nd Venice Film Festival in 2005. Available as dvd bonus on 2-disc special edition.,7.53,1559,5240,11124,4694,white,movie,finished_airing,"[{'id': 1, 'name': 'Action'}, {'id': 8, 'name': 'Drama'}, {'id': 10, 'name': 'Fantasy'}, {'id': 24, 'name': 'Sci-Fi'}]",1,game,1425,pg_13,[],364,,,2005.0,summer,216.0,7749.0,124.0,148.0,2899.0,11136.0,0.9756,0.0244
430,Fullmetal Alchemist: The Conqueror of Shamballa,2005-07-23,2005-07-23,"In desperation, Edward Elric sacrificed his body and soul to rescue his brother Alphonse, and is now displaced in the heart of Munich, Germany. He struggles to adapt to a world completely foreign to him in the wake of the economic crisis that followed the end of World War I. Isolated and unable to return home with his alchemy skills, Edward continues to research other methods of escaping the prison alongside colleagues who bear striking resemblances to many of the people he left behind. As dissent brews among the German citizenry, its neighbors also feel the unrest of the humiliated nation.

Meanwhile, Alphonse continues to investigate Edward's disappearance, delving into the science of alchemy in the hopes of finally reuniting with his older brother. 

[Written by MAL Rewrite]",7.53,1561,604,305401,192694,white,movie,finished_airing,"[{'id': 4, 'name': 'Comedy'}, {'id': 8, 'name': 'Drama'}, {'id': 10, 'name': 'Fantasy'}, {'id': 13, 'name': 'Historical'}, {'id': 38, 'name': 'Military'}, {'id': 27, 'name': 'Shounen'}]",1,manga,6300,pg_13,"[{'id': 4, 'name': 'Bones'}]",365,,,2005.0,summer,2711.0,265048.0,1479.0,868.0,35548.0,305654.0,0.9923,0.0077
38816,Hello World,2019-09-20,2019-09-20,"The year is 2027, and the city of Kyoto has undergone tremendous technological advancement. Within the city lives Naomi Katagaki, a socially awkward and introverted boy with a love for books, and Ruri Ichigyou, a girl with a cold personality who is often blunt with people, but shares his love for reading. Despite having similar interests, Naomi is afraid to approach Ruri due to her unfriendly nature.

One day, as Naomi goes out for a walk, a crimson aurora pierces through the sky for a brief moment before vanishing. Shortly after, he sees a three-legged crow and a mysterious hooded man who reveals himself to be Naomi from 10 years in the future, explaining that he has come to change an imminent tragic event that happens to Ruri shortly after they start dating. Initially taking his words with a grain of salt, present-day Naomi follows his future self's instructions and starts getting closer to Ruri, determined to save her.

Hello World focuses on the present Naomi alongside himself from 10 years into the future. With the help of his future self, Naomi begins his preparations to save Ruri. Will he be able to change the future?

[Written by MAL Rewrite]",7.53,1565,1010,185488,81905,white,movie,finished_airing,"[{'id': 8, 'name': 'Drama'}, {'id': 22, 'name': 'Romance'}, {'id': 24, 'name': 'Sci-Fi'}]",1,original,5863,pg_13,"[{'id': 894, 'name': 'Graphinica'}]",366,,,2019.0,summer,5777.0,102137.0,1898.0,1184.0,75824.0,186820.0,0.9835,0.0165
33520,Koutetsujou no Kabaneri Movie 2: Moeru Inochi,2017-01-07,2017-01-07,Compilation film of the second half of the TV series. ,7.53,1570,2914,40318,12051,white,movie,finished_airing,"[{'id': 1, 'name': 'Action'}, {'id': 8, 'name': 'Drama'}, {'id': 10, 'name': 'Fantasy'}, {'id': 14, 'name': 'Horror'}, {'id': 37, 'name': 'Supernatural'}]",1,original,6209,r,"[{'id': 858, 'name': 'Wit Studio'}]",367,,,2017.0,winter,1043.0,18991.0,487.0,543.0,19437.0,40501.0,0.9746,0.0254
35984,Mahou Shoujo Lyrical Nanoha: Detonation,2018-10-19,2018-10-19,"The story continues directly from Reflection. As the conflict continues to escalate, Nanoha and her allies soon found out the troubled history between Iris and Yuri, which is related to the tragedy of Eltoria's ""Planet Reclamation Committee"".

(Source: Nanoha Wiki)",7.53,1573,6136,7569,2384,white,movie,finished_airing,"[{'id': 1, 'name': 'Action'}, {'id': 4, 'name': 'Comedy'}, {'id': 8, 'name': 'Drama'}, {'id': 31, 'name': 'Super Power'}]",1,original,6660,no_rating,"[{'id': 1569, 'name': 'Seven Arcs Pictures'}]",368,,,2018.0,fall,206.0,3228.0,99.0,111.0,3948.0,7592.0,0.9723,0.0277
10259,Da Yu Hai Tang (Movie),2016-07-08,2016-07-08,"In an old mythical world, there reside spirit-like beings who oversee the natural order of the mortal realm. One of them, a young girl named Chun, has just come of age and must undergo her rite of passage by experiencing the human world for herself. While there, she gets caught in a fishing net during a storm and is rescued by a human boy.

However, the boy ends up drowning during the incident, and Chun returns to her realm full of guilt. Afterwards, she meets the Soul Keeper and decides to revive the boy in exchange for a part of her lifespan. Little does she know, meddling with the natural order of the world has severe consequences.

Da Yu Hai Tang is a story about sacrifice and redemption as Chun comes to terms with the limitations of her powers and deals with death, love, and her own emotions. She must decide if she will sacrifice everything to save the human boy or forsake her moral obligation for the order of the world.

[Written by MAL Rewrite]",7.52,1577,3053,37249,14144,white,movie,finished_airing,"[{'id': 2, 'name': 'Adventure'}, {'id': 8, 'name': 'Drama'}, {'id': 22, 'name': 'Romance'}, {'id': 37, 'name': 'Supernatural'}]",1,original,6321,pg_13,"[{'id': 1462, 'name': 'B&T'}]",369,,,2016.0,summer,944.0,18132.0,404.0,305.0,17492.0,37277.0,0.981,0.019
2848,Kappa no Coo to Natsuyasumi,2007-07-28,2007-07-28,"Kouichi Uehara is a fourth grade student living in the suburb of Tokyo. One day, he picks up a large stone which turns out to be a fossil of a baby ""Kappa"" who has been sleeping underground for the past 300 years, and names it ""Coo."" They become good friends and Coo starts living with Kouichi's family. However, Coo has a hard time adjusting to life among humans and misses his kind.",7.52,1582,4648,15047,6586,white,movie,finished_airing,"[{'id': 2, 'name': 'Adventure'}, {'id': 6, 'name': 'Demons'}, {'id': 27, 'name': 'Shounen'}]",1,original,8505,pg,"[{'id': 247, 'name': 'Shin-Ei Animation'}]",370,,,2007.0,summer,301.0,8812.0,187.0,145.0,5624.0,15069.0,0.978,0.022
33034,Kiniro Mosaic: Pretty Days,2016-11-12,2016-11-12,"The episode is set during a school festival where Shinobu is assigned to write a script and make outfits for her class play. Youko and Alice notice that Shinobu is sleepy every morning and are worried that she might be getting tired of all the work. Will Shinobu be able to successfully complete all her tasks in time?

(Source: MAL News)",7.52,1583,3945,22279,9118,white,movie,finished_airing,"[{'id': 4, 'name': 'Comedy'}, {'id': 23, 'name': 'School'}, {'id': 42, 'name': 'Seinen'}, {'id': 36, 'name': 'Slice of Life'}]",1,4_koma_manga,3000,pg_13,"[{'id': 418, 'name': 'Studio Gokumi'}, {'id': 1299, 'name': 'AXsiZ'}]",371,,,2016.0,fall,633.0,12376.0,303.0,164.0,8857.0,22333.0,0.9791,0.0209
33519,Koutetsujou no Kabaneri Movie 1: Tsudou Hikari,2016-12-31,2016-12-31,Compilation film of the first half of the TV series. ,7.52,1585,2883,40956,12607,white,movie,finished_airing,"[{'id': 1, 'name': 'Action'}, {'id': 8, 'name': 'Drama'}, {'id': 10, 'name': 'Fantasy'}, {'id': 14, 'name': 'Horror'}, {'id': 37, 'name': 'Supernatural'}]",1,original,6438,r,"[{'id': 858, 'name': 'Wit Studio'}]",372,,,2016.0,fall,1145.0,19863.0,525.0,546.0,19058.0,41137.0,0.974,0.026
7651,Ningen Shikkaku: Director's Cut-ban,2009-12-12,2009-12-12,"A theatrical film version of Madhouse's Aoi Bungaku Series anime. The film will re-edit the four episodes based on Osamu Dazai's No Longer Human (Ningen Shikkaku) novel, which have character designs inspired by manga artist and novel illustrator Takeshi Obata. This ""director's cut"" will include new ""navigation"" footage which is being created specifically for the film with narrator Masato Sakai.",7.52,1588,5519,9739,1860,white,movie,finished_airing,"[{'id': 8, 'name': 'Drama'}, {'id': 13, 'name': 'Historical'}, {'id': 40, 'name': 'Psychological'}, {'id': 42, 'name': 'Seinen'}]",1,novel,5340,r,"[{'id': 11, 'name': 'Madhouse'}]",373,,,2009.0,fall,316.0,2678.0,211.0,162.0,6380.0,9747.0,0.9617,0.0383
10716,Towa no Quon 5: Souzetsu no Raifuku,2011-11-05,2011-11-05,The story follows a boy named Quon and others who suddenly wake up with supernatural powers.,7.51,1599,3273,32696,16961,white,movie,finished_airing,"[{'id': 1, 'name': 'Action'}, {'id': 24, 'name': 'Sci-Fi'}, {'id': 31, 'name': 'Super Power'}, {'id': 37, 'name': 'Supernatural'}]",1,original,2880,pg_13,"[{'id': 4, 'name': 'Bones'}]",374,,,2011.0,fall,516.0,23899.0,287.0,158.0,7842.0,32702.0,0.9864,0.0136
2673,Doraemon Movie 27: Nobita no Shin Makai Daibouken - 7-nin no Mahoutsukai,2007-03-10,2007-03-10,"Nobita requests of Doraemon the Moshimo-box and wishes for the world to become a place where the use of magic is possible. Witchcraft replaces science and technology and everyone makes use of it on their daily lives, except for Nobita, who, like usual, isn't very good at conjuring spells. Frustrated, he plans on returning things to their past state, but his mother threw the Moshimo-box away. 

One day, Doraemon and his friends meet Professor Mangetsu, who studies magic and magical beings such as goblins, and his daughter Miyoko, and are warned of the dangerous approximation of the ""star of the Underworld"" to the Earth's orbit. 

With the future of the planet at stake, the group must travel to the Underworld and pierce the heart of the Underworld King with a silver dart, as detailed in the ancient texts of ""The Chronicles of the Underworld"". Their attempts are, however, thwarted and Miyoko captured. 

Doraemon and his friends then decided to use the Time Machine to return to the past and, using Dorami's Moshimo-box, they manage to restore the Earth. The events on the Underworld continue, however, to take place in a Parallel Universe, where Miyoko is still captive. As a result, the group is once again forced to travel to the Underworld and defeat its tyrannical ruler once and for all. 

(Source: AniDB)",7.51,1607,6340,6937,4315,white,movie,finished_airing,"[{'id': 2, 'name': 'Adventure'}, {'id': 4, 'name': 'Comedy'}, {'id': 10, 'name': 'Fantasy'}]",1,unknown,6900,pg,"[{'id': 247, 'name': 'Shin-Ei Animation'}]",375,,,2007.0,winter,91.0,6028.0,47.0,120.0,672.0,6958.0,0.976,0.024
31418,KanColle Movie,2016-11-26,2016-11-26,"The movie starts off after the events of Episode 3, when Kisaragi had sunk. The Mikawa Fleet (Furutaka, Aoba, Kako, Kinugasa and Tenryuu) are in the middle of Night Battle. Choukai uses Searchlight and gets medium damage, but they win in the end. A New Fleet Girl gets ""dropped"", emerging from the sea. It is Kisaragi. Kisaragi is brought back to the temporary base in Solomon Islands, but she is suffering from PTSD and has amnesia, unable to remember anyone from back in the anime, excluding Mutsuki...

(Source: Wikipedia)",7.51,1615,3077,36688,14767,white,movie,finished_airing,"[{'id': 1, 'name': 'Action'}, {'id': 8, 'name': 'Drama'}, {'id': 38, 'name': 'Military'}, {'id': 24, 'name': 'Sci-Fi'}]",1,game,5574,pg_13,"[{'id': 51, 'name': 'Diomedéa'}]",376,,,2016.0,fall,999.0,19581.0,526.0,267.0,15393.0,36766.0,0.9784,0.0216
12917,Madang-eul Naon Amtalg,2011-07-28,2011-07-28,A Korean animation about a hen named Leafie who lives and works on an egg farm who dreams of freedom outside her cage. One day she fakes her own death to escape the farm.,7.51,1621,8125,3638,1396,white,movie,finished_airing,"[{'id': 2, 'name': 'Adventure'}, {'id': 8, 'name': 'Drama'}, {'id': 10, 'name': 'Fantasy'}, {'id': 15, 'name': 'Kids'}]",1,book,5538,g,"[{'id': 1473, 'name': 'Odolttogi'}]",377,,,2011.0,summer,104.0,1909.0,30.0,107.0,1491.0,3641.0,0.9624,0.0376
4835,Bleach Movie 3: Fade to Black - Kimi no Na wo Yobu,2008-12-13,2008-12-13,"After a mysterious pair attack Rukia Kuchiki and erase her memories while she is in Seireitei, Ichigo Kurosaki, a substitute Soul Reaper, briefly forgets Rukia, until he is reminded of her by Kon, an Underpod Mod-Soul. Confused, he seeks his town's candy-shop owner, Kisuke Urahara, who opens the pathway to Seireitei for them. Ichigo is then shocked to find that his allies in Seireitei, the Shinigami of the Soul Society, have forgotten him.

Filled with action, Kimi no Na wo Yobu follows Ichigo and Kon as they fight against their former comrades while searching for the missing Rukia and discovering her assailants before they strike again.

[Written by MAL Rewrite]",7.5,1625,917,207361,123511,white,movie,finished_airing,"[{'id': 1, 'name': 'Action'}, {'id': 2, 'name': 'Adventure'}, {'id': 4, 'name': 'Comedy'}, {'id': 27, 'name': 'Shounen'}, {'id': 31, 'name': 'Super Power'}, {'id': 37, 'name': 'Supernatural'}]",1,manga,5680,pg_13,"[{'id': 1, 'name': 'Studio Pierrot'}]",378,,,2008.0,fall,1981.0,184038.0,958.0,501.0,20045.0,207523.0,0.993,0.007
19191,Koukaku Kidoutai Arise: Ghost in the Shell - Border:2 Ghost Whispers,2013-11-30,2013-11-30,"Second movie of Ghost in the Shell: Arise.

Freed of her responsibilities with the 501 Organization, Motoko Kusanagi must now learn how to take orders from Aramaki. Someone hacks the Logicomas, and Batou enlists the help of former army intelligence officer Ishikawa and former air artillery expert Borma. Kusanagi also seeks to enlist ace sniper Saito and undercover cop Paz into the new Public Security Section 9. The two groups rival each other in a case involving a man who receives false memories of a refugee transport operation.

(Source: Wikipedia)",7.5,1639,2682,47051,23087,white,movie,finished_airing,"[{'id': 18, 'name': 'Mecha'}, {'id': 39, 'name': 'Police'}, {'id': 40, 'name': 'Psychological'}, {'id': 24, 'name': 'Sci-Fi'}]",1,manga,3379,r,"[{'id': 10, 'name': 'Production I.G'}]",379,,,2013.0,fall,753.0,32018.0,399.0,220.0,13682.0,47072.0,0.9868,0.0132
1034,Ouritsu Uchuugun: Honneamise no Tsubasa,1987-03-14,1987-03-14,"Shirotsugh ""Shiro"" Lhadatt may be a cadet in the Kingdom of Honneamise's Royal Space Force (RSF), but he has never been in space before—in fact, nobody has. The RSF is often regarded as a failure both by the country's citizens and a government more interested in precipitating a war with a neighboring country than scientific achievement. Following the funeral of a fellow cadet, an unmotivated Shiro is walking in the city one night, when he bumps into Riquinni Nonderaiko, a young, pious woman, genuinely enthusiastic about the significance of space exploration.

As the two gradually bond, Riquinni's encouragement inspires Shiro to volunteer as a pilot for a prospective rocket ship, potentially becoming Honneamise's first man in space. Shiro and the RSF are soon joined by a team of elderly but eager scientists and engineers, and together, they embark on a mission to mold their nation's space program into a success. However, their efforts soon catch the attention of the government, which seems to have a different plan for the RSF in mind. Even as the odds are stacked against them, these men and women continue to stubbornly look to the sky, because somewhere among the frontiers of space may lie humanity's last chance at redemption.

[Written by MAL Rewrite]",7.5,1645,2964,39107,14308,white,movie,finished_airing,"[{'id': 1, 'name': 'Action'}, {'id': 8, 'name': 'Drama'}, {'id': 38, 'name': 'Military'}, {'id': 24, 'name': 'Sci-Fi'}, {'id': 29, 'name': 'Space'}]",1,original,7286,r+,"[{'id': 6, 'name': 'Gainax'}]",380,,,1987.0,winter,974.0,18002.0,444.0,269.0,19483.0,39172.0,0.9818,0.0182
9979,Precure All Stars Movie DX3: Mirai ni Todoke! Sekai wo Tsunagu☆Nijiiro no Hana,2011-03-19,2011-03-19,Precure 10th Anniversary Movie and 3rd Precure All Stars DX. Enemies are from all the Precure works. ,7.5,1648,7025,5325,2311,white,movie,finished_airing,"[{'id': 1, 'name': 'Action'}, {'id': 10, 'name': 'Fantasy'}, {'id': 25, 'name': 'Shoujo'}]",1,original,4284,g,"[{'id': 18, 'name': 'Toei Animation'}]",381,,,2011.0,winter,107.0,3493.0,68.0,123.0,1538.0,5329.0,0.9642,0.0358
39569,Sora no Aosa wo Shiru Hito yo,2019-10-11,2019-10-11,"High school student Aoi Aioi lives with her elder sister, Akane, after a tragic accident took their parents away 13 years ago. Because Akane has since been taking care of her single-handedly, Aoi wants to move to Tokyo after her graduation to relieve her sister's burden and pursue a musical career, inspired by Akane's ex-boyfriend Shinnosuke ""Shinno"" Kanamuro. Shinno was part of a band until he left for Tokyo to become a professional guitarist after the sisters' parents passed away, and he was never to be seen again.

One afternoon, while Aoi practices her bass in a guest house, she gets startled by the 18-year-old version of Shinno from 13 years ago! As if by coincidence, the current 31-year-old Shinno also returns to the town, but he has changed drastically. There are now two Shinno's in existence, but why is the Shinno from the past present?

Sora no Aosa wo Shiru Hito yo revolves around these four individuals as they confront their inner feelings toward each other and make decisions that will affect their lives from here on out.

[Written by MAL Rewrite]",7.5,1653,1857,87087,29633,white,movie,finished_airing,"[{'id': 8, 'name': 'Drama'}, {'id': 19, 'name': 'Music'}, {'id': 22, 'name': 'Romance'}, {'id': 37, 'name': 'Supernatural'}]",1,original,6391,pg_13,"[{'id': 1835, 'name': 'CloverWorks'}]",382,,,2019.0,fall,2979.0,37206.0,1096.0,387.0,45908.0,87576.0,0.9831,0.0169
37682,Wakaokami wa Shougakusei! Movie,2018-09-21,2018-09-21,"After reluctantly being dragged to a festival at her parents' rural hometown, Oriko ""Okko"" Seki must face her sudden harsh reality: the death of both of her parents in a car accident shortly after they arrive. Now, Okko must live at her grandmother's traditional hot springs inn, which she is surprised to find is occupied by the ghost of a barefoot child. He encourages Okko to follow in her grandmother's footsteps and prepare to inherit the inn.

Initially, Okko struggles to keep up with the responsibilities of the inn and the accommodation of guests. However, her parents told her that an inn is welcoming for everyone, and she strives to honor their memory. After discovering a few other spirits around the village, Okko learns that even though her parents are gone, she does not have to be lonely.

[Written by MAL Rewrite]",7.5,1657,4669,14859,6796,white,movie,finished_airing,"[{'id': 4, 'name': 'Comedy'}, {'id': 36, 'name': 'Slice of Life'}, {'id': 37, 'name': 'Supernatural'}]",1,novel,5640,g,"[{'id': 11, 'name': 'Madhouse'}, {'id': 276, 'name': 'DLE'}]",383,,,2018.0,summer,388.0,8508.0,167.0,106.0,5773.0,14942.0,0.9817,0.0183
