id,title,main_picture,start_date,end_date,synopsis,mean,rank,popularity,num_list_users,num_scoring_users,nsfw,created_at,updated_at,media_type,status,genres,num_episodes,start_season,broadcast,source,average_episode_duration,rating,background,studios,statistics,bypopularity_ranking
32542,Sakamoto Desu ga?,"{'medium': 'https://api-cdn.myanimelist.net/images/anime/4/79468.jpg', 'large': 'https://api-cdn.myanimelist.net/images/anime/4/79468l.jpg'}",2016-04-08,2016-07-01,"Sophisticated, suave, sublime; all words which describe the exceedingly handsome and patently perfect Sakamoto. Though it is only his first day in high school, his attractiveness, intelligence, and charm already has the girls swooning and the guys fuming with jealousy. No one seems able to derail him, as all attempts at tripping him up are quickly foiled. His sangfroid is indomitable, his wits peerless. Will any of Sakamoto's classmates, or even teachers, be able to reach his level of excellence? Probably not, but they just might learn a thing or two trying...

[Written by MAL Rewrite]",7.57,1405.0,230,665580,323663,white,2016-01-14T14:10:15+00:00,2022-03-22T13:27:37+00:00,tv,finished_airing,"[{'id': 4, 'name': 'Comedy'}, {'id': 23, 'name': 'School'}, {'id': 42, 'name': 'Seinen'}, {'id': 36, 'name': 'Slice of Life'}]",12,"{'year': 2016, 'season': 'spring'}","{'day_of_the_week': 'friday', 'start_time': '02:28'}",manga,1460,pg_13,,"[{'id': 37, 'name': 'Studio Deen'}]","{'status': {'watching': '50037', 'completed': '400890', 'on_hold': '31619', 'dropped': '43976', 'plan_to_watch': '141021'}, 'num_list_users': 667543}",230
11759,Accel World,"{'medium': 'https://api-cdn.myanimelist.net/images/anime/8/38155.jpg', 'large': 'https://api-cdn.myanimelist.net/images/anime/8/38155l.jpg'}",2012-04-07,2012-09-22,"Haruyuki Arita is an overweight, bullied middle schooler who finds solace in playing online games. But his life takes a drastic turn one day, when he finds that all his high scores have been topped by Kuroyukihime, the popular vice president of the student council. She then invites him to the student lounge and introduces him to ""Brain Burst,"" a program which allows the users to accelerate their brain waves to the point where time seems to stop. Brain Burst also functions as an augmented reality fighting game, and in order to get more points to accelerate, users must win duels against other players. However, if a user loses all their points, they will also lose access to Brain Burst forever.

Kuroyukihime explains that she chose to show Haruyuki the program because she needs his help. She wants to meet the creator of Brain Burst and uncover the reason of why it was created, but that's easier said than done; to do so, she must defeat the ""Six Kings of Pure Color,"" powerful faction leaders within the game, and reach level 10, the highest level attainable. After the girl helps Haruyuki overcome the bullies that torment him, he vows to help her realize her goal, and so begins the duo's fight to reach the top.

[Written by MAL Rewrite]",7.25,2681.0,231,659430,346535,white,2011-10-09T11:37:29+00:00,2022-03-21T23:40:34+00:00,tv,finished_airing,"[{'id': 1, 'name': 'Action'}, {'id': 11, 'name': 'Game'}, {'id': 22, 'name': 'Romance'}, {'id': 23, 'name': 'School'}, {'id': 24, 'name': 'Sci-Fi'}]",24,"{'year': 2012, 'season': 'spring'}","{'day_of_the_week': 'saturday', 'start_time': '00:30'}",light_novel,1440,pg_13,"Accel World adapts the first 4 novels of Reki Kawahara's light novel series of the same title, as well as content from the 10th novel.","[{'id': 14, 'name': 'Sunrise'}]","{'status': {'watching': '29672', 'completed': '444651', 'on_hold': '22260', 'dropped': '43413', 'plan_to_watch': '119684'}, 'num_list_users': 659680}",231
33506,Ao no Exorcist: Kyoto Fujouou-hen,"{'medium': 'https://api-cdn.myanimelist.net/images/anime/5/85201.jpg', 'large': 'https://api-cdn.myanimelist.net/images/anime/5/85201l.jpg'}",2017-01-07,2017-03-25,"The ExWire of True Cross Academy are beset with shock and fear in the aftermath of discovering that one of their own classmates, Rin Okumura, is the son of Satan. But for the moment, they have more pressing concerns than that of Rin's parentage: the left eye of the Impure King, a powerful demon, has been stolen from the academy's Deep Keep. After an attempt is made to steal the right eye in Kyoto as well, Rin and the other ExWires are sent to investigate the mystery behind the Impure King and the ultimate goal of the thief.

While this mission has them cooperating for the time being, Rin has never felt more distant from his fellow exorcists. In his attempt to reconcile with them, he undergoes specialized training to control his dark power. However, when the right eye is stolen not long after their arrival, the unthinkable threat of a traitor amongst them leaves them in need of all the power they can get.

[Written by MAL Rewrite]",7.37,2117.0,232,658145,346951,white,2016-06-29T10:52:09+00:00,2022-03-22T11:59:50+00:00,tv,finished_airing,"[{'id': 1, 'name': 'Action'}, {'id': 6, 'name': 'Demons'}, {'id': 10, 'name': 'Fantasy'}, {'id': 27, 'name': 'Shounen'}, {'id': 37, 'name': 'Supernatural'}]",12,"{'year': 2017, 'season': 'winter'}","{'day_of_the_week': 'saturday', 'start_time': '01:55'}",manga,1470,pg_13,,"[{'id': 56, 'name': 'A-1 Pictures'}]","{'status': {'watching': '32579', 'completed': '482308', 'on_hold': '15793', 'dropped': '16977', 'plan_to_watch': '112531'}, 'num_list_users': 660188}",232
30307,Monster Musume no Iru Nichijou,"{'medium': 'https://api-cdn.myanimelist.net/images/anime/9/75104.jpg', 'large': 'https://api-cdn.myanimelist.net/images/anime/9/75104l.jpg'}",2015-07-08,2015-09-23,"With his parents abroad, Kimihito Kurusu lived a quiet, unremarkable life alone until monster girls came crowding in! This alternate reality presents cutting-edge Japan, the first country to promote the integration of non-human species into society. After the incompetence of interspecies exchange coordinator Agent Smith leaves Kimihito as the homestay caretaker of a Lamia named Miia, the newly-minted ""Darling"" quickly attracts girls of various breeds, resulting in an ever-growing harem flush with eroticism and attraction.

Unfortunately for him and the ladies, sexual interactions between species is forbidden by the Interspecies Exchange Act! The only loophole is through an experimental marriage provision. Kimihito's life becomes fraught with an abundance of creature-specific caveats and sensitive interspecies law as the passionate, affectionate, and lusty women hound his every move, seeking his romantic and sexual affections. With new species often appearing and events materializing out of thin air, where Kimihito and his harem go is anyone's guess!

[Written by MAL Rewrite]",7.01,3792.0,233,655241,370524,white,2015-03-11T18:13:40+00:00,2022-03-22T08:09:33+00:00,tv,finished_airing,"[{'id': 4, 'name': 'Comedy'}, {'id': 9, 'name': 'Ecchi'}, {'id': 10, 'name': 'Fantasy'}, {'id': 35, 'name': 'Harem'}, {'id': 22, 'name': 'Romance'}, {'id': 42, 'name': 'Seinen'}]",12,"{'year': 2015, 'season': 'summer'}","{'day_of_the_week': 'wednesday', 'start_time': '00:30'}",manga,1420,r+,"Episodes 1 and 2 were previewed at a screening at Odaiba Cinema Mediage on June 27, 2015. Regular broadcasting began on July 8, 2015.","[{'id': 456, 'name': 'Lerche'}]","{'status': {'watching': '31417', 'completed': '486761', 'on_hold': '14603', 'dropped': '31910', 'plan_to_watch': '92776'}, 'num_list_users': 657467}",233
18671,Chuunibyou demo Koi ga Shitai! Ren,"{'medium': 'https://api-cdn.myanimelist.net/images/anime/7/56643.jpg', 'large': 'https://api-cdn.myanimelist.net/images/anime/7/56643l.jpg'}",2014-01-09,2014-03-27,"The awkward lovebirds, Yuuta Togashi and Rikka Takanashi are now living together as they enter a new school year, but their adorable relationship remains stagnant. Yuuta struggles to adapt to having a chuuni girlfriend while the gang—Sanae Dekomori, Shinka Nibutani and Kumin Tsuyuri—are still keeping up with their quirks despite having advanced a grade. Making matters worse, another chuuni girl from Yuuta's middle school, Satone Shichimiya, appears...

With the various events revolving around Yuuta, will he be able to develop his relationship with Rikka?

[Written by MAL Rewrite]
",7.56,1436.0,234,651706,389469,white,2013-05-08T12:46:53+00:00,2022-03-22T10:52:21+00:00,tv,finished_airing,"[{'id': 4, 'name': 'Comedy'}, {'id': 8, 'name': 'Drama'}, {'id': 22, 'name': 'Romance'}, {'id': 23, 'name': 'School'}, {'id': 36, 'name': 'Slice of Life'}]",12,"{'year': 2014, 'season': 'winter'}","{'day_of_the_week': 'thursday', 'start_time': '00:30'}",light_novel,1440,pg_13,,"[{'id': 2, 'name': 'Kyoto Animation'}]","{'status': {'watching': '22962', 'completed': '503131', 'on_hold': '14421', 'dropped': '13222', 'plan_to_watch': '98237'}, 'num_list_users': 651973}",234
31798,Kiznaiver,"{'medium': 'https://api-cdn.myanimelist.net/images/anime/6/78466.jpg', 'large': 'https://api-cdn.myanimelist.net/images/anime/6/78466l.jpg'}",2016-04-09,2016-06-25,"Katsuhira Agata is a quiet and reserved teenage boy whose sense of pain has all but vanished. His friend, Chidori Takashiro, can only faintly remember the days before Katsuhira had undergone this profound change. Now, his muffled and complacent demeanor make Katsuhira a constant target for bullies, who exploit him for egregious sums of money. But their fists only just manage to make him blink, as even emotions are far from his grasp.

However, one day Katsuhira, Chidori, and four other teenagers are abducted and forced to join the Kizuna System as official ""Kiznaivers."" Those taking part are connected through pain: if one member is injured, the others will feel an equal amount of agony. These individuals must become the lab rats and scapegoats of an incomplete system designed with world peace in mind. With their fates literally intertwined, the Kiznaivers must expose their true selves to each other, or risk failing much more than just the Kizuna System.

[Written by MAL Rewrite]",7.4,1993.0,235,649361,310562,white,2015-10-08T08:23:00+00:00,2022-03-22T13:47:26+00:00,tv,finished_airing,"[{'id': 8, 'name': 'Drama'}, {'id': 22, 'name': 'Romance'}, {'id': 24, 'name': 'Sci-Fi'}]",12,"{'year': 2016, 'season': 'spring'}","{'day_of_the_week': 'saturday', 'start_time': '23:30'}",original,1440,pg_13,,"[{'id': 803, 'name': 'Trigger'}]","{'status': {'watching': '39569', 'completed': '394036', 'on_hold': '19396', 'dropped': '26306', 'plan_to_watch': '171870'}, 'num_list_users': 651177}",235
24415,Kuroko no Basket 3rd Season,"{'medium': 'https://api-cdn.myanimelist.net/images/anime/4/68299.jpg', 'large': 'https://api-cdn.myanimelist.net/images/anime/4/68299l.jpg'}",2015-01-11,2015-06-30,"Following their triumph against Yousen High, Seirin's basketball team has reached the semifinals of the Winter Cup along with Kaijou, Rakuzan, and Shuutoku. Each of these teams possesses a member of the Generation of Miracles, and Seirin prepares to face the largest obstacles on their path to winning the Winter Cup.
 
In the final season of Kuroko no Basket, Kuroko goes head-to-head with his old teammates once more as he attempts to show them that individual skill is not the only way to play basketball. His firm belief that his form of basketball, team play, is the right way to play the sport will clash with the talents of a perfect copy and an absolute authority.

While Kuroko tries to prove that his basketball is ""right,"" he and the rest of Seirin High ultimately have one goal: to win the Winter Cup and overcome the strength of the Generation of Miracles, who have long dominated the scene of middle and high school basketball.

[Written by MAL Rewrite]",8.31,224.0,236,647910,393627,white,2014-05-28T07:12:25+00:00,2022-03-22T11:53:52+00:00,tv,finished_airing,"[{'id': 4, 'name': 'Comedy'}, {'id': 23, 'name': 'School'}, {'id': 27, 'name': 'Shounen'}, {'id': 30, 'name': 'Sports'}]",25,"{'year': 2015, 'season': 'winter'}","{'day_of_the_week': 'sunday', 'start_time': '01:58'}",manga,1450,pg_13,,"[{'id': 10, 'name': 'Production I.G'}]","{'status': {'watching': '29950', 'completed': '529948', 'on_hold': '10595', 'dropped': '6356', 'plan_to_watch': '71191'}, 'num_list_users': 648040}",236
41025,Fumetsu no Anata e,"{'medium': 'https://api-cdn.myanimelist.net/images/anime/1880/118484.jpg', 'large': 'https://api-cdn.myanimelist.net/images/anime/1880/118484l.jpg'}",2021-04-12,2021-08-30,"An Orb, known only as It, is cast to Earth to be observed from afar. Capable of changing forms from beings whose reflections It captures, It first becomes a rock and then, due to the rising temperature, moss.

It does not move until one snowy day, a wolf at death's door barely crosses by. When It takes the animal's form, It attains awareness of its consciousness and starts to wander with an unclear destination in mind. Soon, It comes across the wolf's master—a young boy waiting for his tribe to return from a paradise abundant with fish and fruit in the south. Although the boy is lonely, he still hopes those whom he holds dear in his memories have not forgotten him and that he will reunite with them one day.

The boy wants to explore new surroundings and decides to abandon his home with It to find the paradise using the traces his tribe left behind. However, with a heavily injured body and no sight of his elder comrades, what will become of the boy?

Fumetsu no Anata e illustrates the story of an immortal being experiencing humanity, meeting all types of people in many places throughout time.

[Written by MAL Rewrite]",8.4,164.0,237,645427,222843,white,2020-01-09T03:02:11+00:00,2022-03-22T12:06:39+00:00,tv,finished_airing,"[{'id': 2, 'name': 'Adventure'}, {'id': 8, 'name': 'Drama'}, {'id': 27, 'name': 'Shounen'}, {'id': 37, 'name': 'Supernatural'}]",20,"{'year': 2021, 'season': 'spring'}","{'day_of_the_week': 'monday', 'start_time': '22:50'}",manga,1500,r,,"[{'id': 112, 'name': ""Brain's Base""}]","{'status': {'watching': '165477', 'completed': '215450', 'on_hold': '33234', 'dropped': '21612', 'plan_to_watch': '211511'}, 'num_list_users': 647284}",237
6,Trigun,"{'medium': 'https://api-cdn.myanimelist.net/images/anime/7/20310.jpg', 'large': 'https://api-cdn.myanimelist.net/images/anime/7/20310l.jpg'}",1998-04-01,1998-09-30,"Vash the Stampede is the man with a $$60,000,000,000 bounty on his head. The reason: he's a merciless villain who lays waste to all those that oppose him and flattens entire cities for fun, garnering him the title ""The Humanoid Typhoon."" He leaves a trail of death and destruction wherever he goes, and anyone can count themselves dead if they so much as make eye contact—or so the rumors say. In actuality, Vash is a huge softie who claims to have never taken a life and avoids violence at all costs.

With his crazy doughnut obsession and buffoonish attitude in tow, Vash traverses the wasteland of the planet Gunsmoke, all the while followed by two insurance agents, Meryl Stryfe and Milly Thompson, who attempt to minimize his impact on the public. But soon, their misadventures evolve into life-or-death situations as a group of legendary assassins are summoned to bring about suffering to the trio. Vash's agonizing past will be unraveled and his morality and principles pushed to the breaking point.

[Written by MAL Rewrite]",8.22,296.0,238,644812,311071,white,2005-11-10T17:34:54+00:00,2022-03-22T10:01:38+00:00,tv,finished_airing,"[{'id': 1, 'name': 'Action'}, {'id': 2, 'name': 'Adventure'}, {'id': 4, 'name': 'Comedy'}, {'id': 8, 'name': 'Drama'}, {'id': 24, 'name': 'Sci-Fi'}, {'id': 27, 'name': 'Shounen'}]",26,"{'year': 1998, 'season': 'spring'}","{'day_of_the_week': 'thursday', 'start_time': '01:15'}",manga,1480,pg_13,"The Japanese release by Victor Entertainment has different openings relating to the specific episode it's played on. The initial Geneon Entertainment USA (then known as Pioneer) releases on VHS and DVD (singles, Signature Series, and box set) used only the first opening on each episode. This was due to the Japanese licensor providing them clean materials for only the first opening to put the English credits on. Geneon later fixed this mistake on their Limited Edition tin releases in 2005/2006, as well as on the Remix singles. Following Geneon USA's demise in late 2007, the show went out of print. When FUNimation Entertainment picked up the show in 2010 and released it, they repeated Geneon's mistake of using only the first opening on every episode. This mistake was later fixed in 2013 on the Anime Classics re-release.","[{'id': 11, 'name': 'Madhouse'}]","{'status': {'watching': '34932', 'completed': '386583', 'on_hold': '29136', 'dropped': '15997', 'plan_to_watch': '179101'}, 'num_list_users': 645749}",238
37086,Kakegurui××,"{'medium': 'https://api-cdn.myanimelist.net/images/anime/1496/96519.jpg', 'large': 'https://api-cdn.myanimelist.net/images/anime/1496/96519l.jpg'}",2019-01-09,2019-03-27,"As Yumeko Jabami's fame grows and the reputation of the student council dwindles, Kirari Momobami decides to revolutionize the group. To this end, she announces an election for its next president. The rules are simple: each student in the school receives one chip. Whoever has the most chips by the end of thirty days becomes both the new president and the head of the Momobami clan.

Upon receiving news of this development, the Momobami branch families spring into action. Eleven transfer students arrive at Hyakkao Private Academy, each aiming to lead both the school and the Momobami clan. Equipped with unique talents, they will compete to get as many chips as possible—but their chips are not the only things on the line.

[Written by MAL Rewrite]
",7.21,2893.0,239,637753,372785,white,2018-01-10T02:05:03+00:00,2022-03-22T02:13:04+00:00,tv,finished_airing,"[{'id': 8, 'name': 'Drama'}, {'id': 11, 'name': 'Game'}, {'id': 7, 'name': 'Mystery'}, {'id': 40, 'name': 'Psychological'}, {'id': 23, 'name': 'School'}, {'id': 27, 'name': 'Shounen'}]",12,"{'year': 2019, 'season': 'winter'}","{'day_of_the_week': 'wednesday', 'start_time': '02:30'}",manga,1469,r,,"[{'id': 569, 'name': 'MAPPA'}]","{'status': {'watching': '32407', 'completed': '486048', 'on_hold': '13483', 'dropped': '15750', 'plan_to_watch': '92893'}, 'num_list_users': 640581}",239
31859,Hai to Gensou no Grimgar,"{'medium': 'https://api-cdn.myanimelist.net/images/anime/13/77976.jpg', 'large': 'https://api-cdn.myanimelist.net/images/anime/13/77976l.jpg'}",2016-01-11,2016-03-28,"Fear, survival, instinct. Thrown into a foreign land with nothing but hazy memories and the knowledge of their name, they can feel only these three emotions resonating deep within their souls. A group of strangers is given no other choice than to accept the only paying job in this game-like world—the role of a soldier in the Reserve Army—and eliminate anything that threatens the peace in their new world, Grimgar.

When all of the stronger candidates join together, those left behind must create a party together to survive: Manato, a charismatic leader and priest; Haruhiro, a nervous thief; Yume, a cheerful hunter; Shihoru, a shy mage; Moguzo, a kind warrior; and Ranta, a rowdy dark knight. Despite its resemblance to one, this is no game—there are no redos or respawns; it is kill or be killed. 

It is now up to this ragtag group of unlikely fighters to survive together in a world where life and death are separated only by a fine line. 

[Written by MAL Rewrite]",7.66,1170.0,240,635893,324178,white,2015-10-16T12:41:08+00:00,2022-03-22T09:23:21+00:00,tv,finished_airing,"[{'id': 1, 'name': 'Action'}, {'id': 2, 'name': 'Adventure'}, {'id': 8, 'name': 'Drama'}, {'id': 10, 'name': 'Fantasy'}]",12,"{'year': 2016, 'season': 'winter'}","{'day_of_the_week': 'monday', 'start_time': '00:30'}",light_novel,1440,pg_13,"Episode 1 was previewed at an event at TOHO Cinemas Roppongi Hills in Tokyo on December 26, 2015. Regular broadcasting began January 11, 2016.
Hai to Gensou no Grimgar was licensed by Funimation and was streamed in both Japanese and English in North America starting in January of 2016.","[{'id': 56, 'name': 'A-1 Pictures'}]","{'status': {'watching': '36383', 'completed': '413684', 'on_hold': '15617', 'dropped': '23651', 'plan_to_watch': '148229'}, 'num_list_users': 637564}",240
38680,Fruits Basket 1st Season,"{'medium': 'https://api-cdn.myanimelist.net/images/anime/1447/99827.jpg', 'large': 'https://api-cdn.myanimelist.net/images/anime/1447/99827l.jpg'}",2019-04-06,2019-09-21,"Tooru Honda has always been fascinated by the story of the Chinese Zodiac that her beloved mother told her as a child. However, a sudden family tragedy changes her life, and subsequent circumstances leave her all alone. Tooru is now forced to live in a tent, but little does she know that her temporary home resides on the private property of the esteemed Souma family. Stumbling upon their home one day, she encounters Shigure, an older Souma cousin, and Yuki, the ""prince"" of her school. Tooru explains that she lives nearby, but the Soumas eventually discover her well-kept secret of being homeless when they see her walking back to her tent one night.

Things start to look up for Tooru as they kindly offer to take her in after hearing about her situation. But soon after, she is caught up in a fight between Yuki and his hot-tempered cousin, Kyou. While trying to stop them, she learns that the Souma family has a well-kept secret of their own: whenever they are hugged by a member of the opposite sex, they transform into the animals of the Chinese Zodiac.

With this new revelation, Tooru will find that living with the Soumas is an unexpected adventure filled with laughter and romance.

[Written by MAL Rewrite]",8.22,298.0,241,633835,283292,white,2018-11-12T17:51:09+00:00,2022-03-22T12:12:35+00:00,tv,finished_airing,"[{'id': 4, 'name': 'Comedy'}, {'id': 8, 'name': 'Drama'}, {'id': 22, 'name': 'Romance'}, {'id': 25, 'name': 'Shoujo'}, {'id': 36, 'name': 'Slice of Life'}, {'id': 37, 'name': 'Supernatural'}]",25,"{'year': 2019, 'season': 'spring'}","{'day_of_the_week': 'saturday', 'start_time': '01:23'}",manga,1434,pg_13,,"[{'id': 73, 'name': 'TMS Entertainment'}]","{'status': {'watching': '69622', 'completed': '343314', 'on_hold': '29285', 'dropped': '24078', 'plan_to_watch': '171168'}, 'num_list_users': 637467}",241
1210,NHK ni Youkoso!,"{'medium': 'https://api-cdn.myanimelist.net/images/anime/3/52675.jpg', 'large': 'https://api-cdn.myanimelist.net/images/anime/3/52675l.jpg'}",2006-07-10,2006-12-18,"Twenty-two-year-old college dropout Tatsuhiro Satou has been a hikikomori for almost four years now. In his isolation, he has come to believe in many obscure conspiracy theories, but there is one in particular which he holds unshakable faith in: the theory that the evil conspirator behind his shut-in NEET (Not in Employment, Education or Training) status is the Nihon Hikikomori Kyokai (NHK)—an evil and secret organization dedicated to fostering the spread of hikikomori culture.

NHK ni Youkoso! is a psychological dramedy that follows Tatsuhiro as he strives to escape from the NHK's wicked machinations and the disease of self-wrought isolation, while struggling to even just leave his apartment and find a job. His unexpected encounter with the mysterious Misaki Nakahara might signal a reversal of fortune for Tatsuhiro, but with this meeting comes the inevitable cost of having to face his greatest fear—society.

[Written by MAL Rewrite]",8.32,215.0,242,633432,284450,white,2006-07-12T16:50:23+00:00,2022-03-22T13:41:44+00:00,tv,finished_airing,"[{'id': 4, 'name': 'Comedy'}, {'id': 8, 'name': 'Drama'}, {'id': 40, 'name': 'Psychological'}, {'id': 22, 'name': 'Romance'}]",24,"{'year': 2006, 'season': 'summer'}",,novel,1440,r+,,"[{'id': 3, 'name': 'Gonzo'}]","{'status': {'watching': '34741', 'completed': '339743', 'on_hold': '26736', 'dropped': '17896', 'plan_to_watch': '215309'}, 'num_list_users': 634425}",242
270,Hellsing,"{'medium': 'https://api-cdn.myanimelist.net/images/anime/10/19956.jpg', 'large': 'https://api-cdn.myanimelist.net/images/anime/10/19956l.jpg'}",2001-10-11,2002-01-17,"Hellsing, an organization specializing in dealing with supernatural threats, is called in to eliminate a vampire that is turning the villagers of Cheddar into ghouls. To put an end to this, the leader of the organization, Sir Integra Fairbrook Wingates Hellsing, dispatches her most formidable asset: a powerful vampire known as Alucard.

Armed with only a single handgun, Alucard wreaks havoc on the monsters plaguing Cheddar. However, a young police officer, Seras Victoria, gets caught up in the chaos and becomes mortally wounded as a result. Taking pity on the girl, Alucard gives her a choice: die as a human or live on as a vampire. Seras accepts his offer and begins a new life as a member of Hellsing.

Though it was her decision, Seras struggles with the fact that she is no longer human. Nevertheless, she must embrace being a creature of the night soon if she wants to survive on the front lines in the fight between humans and the supernatural.

[Written by MAL Rewrite]",7.49,1682.0,243,633029,322602,white,2005-11-16T00:27:24+00:00,2022-03-22T02:50:03+00:00,tv,finished_airing,"[{'id': 1, 'name': 'Action'}, {'id': 14, 'name': 'Horror'}, {'id': 42, 'name': 'Seinen'}, {'id': 37, 'name': 'Supernatural'}, {'id': 32, 'name': 'Vampire'}]",13,"{'year': 2001, 'season': 'fall'}",,manga,1380,r,"Hellsing was based on Kouta Hirano’s manga of the same name. The anime utilizes the same characters but the story strongly deviates from the manga, which was still ongoing at the time of the anime’s creation.","[{'id': 3, 'name': 'Gonzo'}]","{'status': {'watching': '25783', 'completed': '423749', 'on_hold': '17943', 'dropped': '18839', 'plan_to_watch': '147595'}, 'num_list_users': 633909}",243
