id,title,start_date,end_date,synopsis,mean,rank,popularity,num_list_users,num_scoring_users,nsfw,media_type,status,genres,num_episodes,source,average_episode_duration,rating,studios,movie_ranking,broadcast_day_of_the_week,broadcast_start_time,start_season_year,start_season_season,statistics_watching,statistics_completed,statistics_on_hold,statistics_dropped,statistics_plan_to_watch,statistics_num_list_users,positive_viewership_fraction,negative_viewership_fraction
39486,Gintama: The Final,2021-01-08,2021-01-08,"Two years have passed following the Tendoshuu's invasion of the O-Edo Central Terminal. Since then, the Yorozuya have gone their separate ways. Foreseeing Utsuro's return, Gintoki Sakata begins surveying Earth's ley lines for traces of the other man's Altana. After an encounter with the remnants of the Tendoshuu—who continue to press on in search of immortality—Gintoki returns to Edo.

Later, the regrouped Shinsengumi and Yorozuya begin an attack on the occupied Central Terminal. With the Altana harvested by the wreckage of the Tendoshuu's ship in danger of detonating, the Yorozuya and their allies fight their enemies while the safety of Edo—and the rest of the world—hangs in the balance. Fulfilling the wishes of their teacher, Shouyou Yoshida's former students unite and relive their pasts one final time in an attempt to save their futures.

[Written by MAL Rewrite]
",9.05,7,1780,92989,40122,white,movie,finished_airing,"[{'id': 1, 'name': 'Action'}, {'id': 4, 'name': 'Comedy'}, {'id': 8, 'name': 'Drama'}, {'id': 13, 'name': 'Historical'}, {'id': 20, 'name': 'Parody'}, {'id': 21, 'name': 'Samurai'}, {'id': 24, 'name': 'Sci-Fi'}, {'id': 27, 'name': 'Shounen'}]",1,manga,6240,pg_13,"[{'id': 1258, 'name': 'Bandai Namco Pictures'}]",1,,,2021.0,winter,4654.0,46274.0,1056.0,807.0,41284.0,94075.0,0.9802,0.0198
28851,Koe no Katachi,2016-09-17,2016-09-17,"As a wild youth, elementary school student Shouya Ishida sought to beat boredom in the cruelest ways. When the deaf Shouko Nishimiya transfers into his class, Shouya and the rest of his class thoughtlessly bully her for fun. However, when her mother notifies the school, he is singled out and blamed for everything done to her. With Shouko transferring out of the school, Shouya is left at the mercy of his classmates. He is heartlessly ostracized all throughout elementary and middle school, while teachers turn a blind eye.

Now in his third year of high school, Shouya is still plagued by his wrongdoings as a young boy. Sincerely regretting his past actions, he sets out on a journey of redemption: to meet Shouko once more and make amends.

Koe no Katachi tells the heartwarming tale of Shouya's reunion with Shouko and his honest attempts to redeem himself, all while being continually haunted by the shadows of his past.
 
[Written by MAL Rewrite]",8.96,14,19,1903702,1315469,white,movie,finished_airing,"[{'id': 8, 'name': 'Drama'}, {'id': 23, 'name': 'School'}, {'id': 27, 'name': 'Shounen'}]",1,manga,7803,pg_13,"[{'id': 2, 'name': 'Kyoto Animation'}]",2,,,2016.0,summer,38606.0,1619978.0,5304.0,2555.0,237236.0,1903679.0,0.9959,0.0041
37987,Violet Evergarden Movie,2020-09-18,2020-09-18,"Several years have passed since the end of The Great War. As the radio tower in Leidenschaftlich continues to be built, telephones will soon become more relevant, leading to a decline in demand for ""Auto Memory Dolls."" Even so, Violet Evergarden continues to rise in fame after her constant success with writing letters. However, sometimes the one thing you long for is the one thing that does not appear.

Violet Evergarden Movie follows Violet as she continues to comprehend the concept of emotion and the meaning of love. At the same time, she pursues a glimmer of hope that the man who once told her, ""I love you,"" may still be alive even after the many years that have passed.

[Written by MAL Rewrite]",8.96,15,437,404739,150030,white,movie,finished_airing,"[{'id': 8, 'name': 'Drama'}, {'id': 10, 'name': 'Fantasy'}, {'id': 36, 'name': 'Slice of Life'}]",1,light_novel,8400,pg_13,"[{'id': 2, 'name': 'Kyoto Animation'}]",3,,,2020.0,summer,11060.0,191285.0,3538.0,875.0,201678.0,408436.0,0.9892,0.0108
15335,Gintama Movie 2: Kanketsu-hen - Yorozuya yo Eien Nare,2013-07-06,2013-07-06,"When Gintoki apprehends a movie pirate at a premiere, he checks the camera's footage and finds himself transported to a bleak, post-apocalyptic version of Edo, where a mysterious epidemic called the ""White Plague"" has ravished the world's population. It turns out that the movie pirate wasn't a pirate after all—it was an android time machine, and Gintoki has been hurtled five years into the future! Shinpachi and Kagura, his Yorozuya cohorts, have had a falling out and are now battle-hardened solo vigilantes and he himself has been missing for years, disappearing without a trace after scribbling a strange message in his journal.

Setting out in the disguise given to him by the android time machine, Gintoki haphazardly reunites the Yorozuya team to investigate the White Plague, and soon discovers that the key to saving the future lies in the darkness of his own past. Determined to confront a powerful foe, he makes an important discovery—with a ragtag band of friends and allies at his side, he doesn't have to fight alone.

[Written by MAL Rewrite]",8.93,18,931,205101,116072,white,movie,finished_airing,"[{'id': 1, 'name': 'Action'}, {'id': 4, 'name': 'Comedy'}, {'id': 13, 'name': 'Historical'}, {'id': 20, 'name': 'Parody'}, {'id': 21, 'name': 'Samurai'}, {'id': 24, 'name': 'Sci-Fi'}, {'id': 27, 'name': 'Shounen'}]",1,manga,6600,pg_13,"[{'id': 14, 'name': 'Sunrise'}]",4,,,2013.0,summer,4465.0,146759.0,1512.0,1419.0,51071.0,205226.0,0.9857,0.0143
32281,Kimi no Na wa.,2016-08-26,2016-08-26,"Mitsuha Miyamizu, a high school girl, yearns to live the life of a boy in the bustling city of Tokyo—a dream that stands in stark contrast to her present life in the countryside. Meanwhile in the city, Taki Tachibana lives a busy life as a high school student while juggling his part-time job and hopes for a future in architecture.

One day, Mitsuha awakens in a room that is not her own and suddenly finds herself living the dream life in Tokyo—but in Taki's body! Elsewhere, Taki finds himself living Mitsuha's life in the humble countryside. In pursuit of an answer to this strange phenomenon, they begin to search for one another.

Kimi no Na wa. revolves around Mitsuha and Taki's actions, which begin to have a dramatic impact on each other's lives, weaving them into a fabric held together by fate and circumstance.

[Written by MAL Rewrite]",8.87,23,11,2283898,1583131,white,movie,finished_airing,"[{'id': 8, 'name': 'Drama'}, {'id': 22, 'name': 'Romance'}, {'id': 23, 'name': 'School'}, {'id': 37, 'name': 'Supernatural'}]",1,original,6391,pg_13,"[{'id': 291, 'name': 'CoMix Wave Films'}]",5,,,2016.0,summer,50433.0,1969360.0,5986.0,3240.0,263766.0,2292785.0,0.996,0.004
31758,Kizumonogatari III: Reiketsu-hen,2017-01-06,2017-01-06,"After helping revive the legendary vampire Kiss-shot Acerola-orion Heart-under-blade, Koyomi Araragi has become a vampire himself and her servant. Kiss-shot is certain she can turn him back into a human, but only once regaining her full power. 

Araragi has hunted down the three vampire hunters that defeated Kiss-shot and retrieved her limbs to return her to full strength. However, now that Araragi has almost accomplished what he’s been fighting for this whole time, he has to consider if this is what he really wants. Once he revives this powerful immortal vampire, there is no telling what she might do, and there would be no way of stopping her.

But there is more to the story that Araragi doesn’t understand. If a newborn vampire like him could defeat the hunters, how did they overpower Kiss-shot? Can he trust her to turn him back to a human? And how is that even possible in the first place?

Araragi is at his limit but he must come to a decision, and it may not be possible to resolve this situation without doing something he’ll regret…

[Written by MAL Rewrite]",8.81,27,456,390720,224282,white,movie,finished_airing,"[{'id': 1, 'name': 'Action'}, {'id': 7, 'name': 'Mystery'}, {'id': 37, 'name': 'Supernatural'}, {'id': 32, 'name': 'Vampire'}]",1,light_novel,4980,r,"[{'id': 44, 'name': 'Shaft'}]",6,,,2017.0,winter,8624.0,283910.0,2452.0,1183.0,96081.0,392250.0,0.9907,0.0093
199,Sen to Chihiro no Kamikakushi,2001-07-20,2001-07-20,"Stubborn, spoiled, and naïve, 10-year-old Chihiro Ogino is less than pleased when she and her parents discover an abandoned amusement park on the way to their new house. Cautiously venturing inside, she realizes that there is more to this place than meets the eye, as strange things begin to happen once dusk falls. Ghostly apparitions and food that turns her parents into pigs are just the start—Chihiro has unwittingly crossed over into the spirit world. Now trapped, she must summon the courage to live and work amongst spirits, with the help of the enigmatic Haku and the cast of unique characters she meets along the way.

Vivid and intriguing, Sen to Chihiro no Kamikakushi tells the story of Chihiro's journey through an unfamiliar world as she strives to save her parents and return home.

[Written by MAL Rewrite]",8.79,32,43,1566400,1096313,white,movie,finished_airing,"[{'id': 2, 'name': 'Adventure'}, {'id': 46, 'name': 'Award Winning'}, {'id': 8, 'name': 'Drama'}, {'id': 37, 'name': 'Supernatural'}]",1,original,7475,pg,"[{'id': 21, 'name': 'Studio Ghibli'}]",7,,,2001.0,summer,19198.0,1416458.0,3925.0,1773.0,128370.0,1569724.0,0.9964,0.0036
33050,Fate/stay night Movie: Heaven's Feel - III. Spring Song,2020-08-15,2020-08-15,"The Fifth Holy Grail War in Fuyuki City has reached a turning point in which the lives of all participants are threatened as the hidden enemy finally reveals itself. As Shirou Emiya, Rin Toosaka, and Illyasviel von Einzbern discover the true, corruptive nature of the shadow that has been rampaging throughout the city, they realize just how dire the situation is. In order to protect their beloved ones, the group must hold their own against the seemingly insurmountable enemy force—even if some of those foes were once their allies, or perhaps, something more intimate.

As the final act of this chaotic war commences, the ideals Shirou believes will soon be challenged by an excruciating dilemma: is it really possible to save a world where everything seems to have gone wrong?

[Written by MAL Rewrite]",8.72,42,743,257693,124969,white,movie,finished_airing,"[{'id': 1, 'name': 'Action'}, {'id': 10, 'name': 'Fantasy'}, {'id': 37, 'name': 'Supernatural'}]",1,visual_novel,7320,r,"[{'id': 43, 'name': 'ufotable'}]",8,,,2020.0,summer,6046.0,154120.0,1673.0,654.0,97264.0,259757.0,0.991,0.009
40456,Kimetsu no Yaiba Movie: Mugen Ressha-hen,2020-10-16,2020-10-16,"After a string of mysterious disappearances begin to plague a train, the Demon Slayer Corps' multiple attempts to remedy the problem prove fruitless. To prevent further casualties, the Flame Pillar, Kyoujurou Rengoku, takes it upon himself to eliminate the threat. Accompanying him are some of the Corps' most promising new blood: Tanjirou Kamado, Zenitsu Agatsuma, and Inosuke Hashibira, who all hope to witness the fiery feats of this model demon slayer firsthand.

Unbeknownst to them, the demonic forces responsible for the disappearances have already put their sinister plan in motion. Under this demonic presence, the group must muster every ounce of their willpower and draw their swords to save all two hundred passengers onboard. Kimetsu no Yaiba Movie: Mugen Ressha-hen delves into the deepest corners of Tanjirou's mind, putting his resolve and commitment to duty to the test.

[Written by MAL Rewrite]",8.68,51,101,1064053,672161,white,movie,finished_airing,"[{'id': 6, 'name': 'Demons'}, {'id': 13, 'name': 'Historical'}, {'id': 27, 'name': 'Shounen'}, {'id': 37, 'name': 'Supernatural'}]",1,manga,7008,r,"[{'id': 43, 'name': 'ufotable'}]",9,,,2020.0,fall,19336.0,847523.0,3164.0,1191.0,198681.0,1069895.0,0.9959,0.0041
36862,Made in Abyss Movie 3: Fukaki Tamashii no Reimei,2020-01-17,2020-01-17,"Continuing their perilous descent down the Abyss, Riko, Regu, and newfound friend Nanachi reach the Abyss' fifth layer, The Sea of Corpses. Upon arriving at the research station known as Idofront, the main trio encounter the mysterious Prushka, the alleged daughter of Bondrewd, who leads them to the White Whistle responsible for Nanachi's dark past. Despite the welcoming appearances of Idofront's residents, Nanachi warns the young adventurers that things are not always what they seem. With the only route to the sixth layer shrouded in mystery and Bonedrewd's schemes awaiting them, what sacrifices must be made in order to continue the journey down to the bottom of the Abyss?

[Written by MAL Rewrite]",8.68,53,595,309359,136970,white,movie,finished_airing,"[{'id': 2, 'name': 'Adventure'}, {'id': 8, 'name': 'Drama'}, {'id': 10, 'name': 'Fantasy'}, {'id': 7, 'name': 'Mystery'}, {'id': 24, 'name': 'Sci-Fi'}]",1,web_manga,6300,r,"[{'id': 290, 'name': 'Kinema Citrus'}]",10,,,2020.0,winter,5862.0,170242.0,1703.0,530.0,132580.0,310917.0,0.9928,0.0072
164,Mononoke Hime,1997-07-12,1997-07-12,"When an Emishi village is attacked by a fierce demon boar, the young prince Ashitaka puts his life at stake to defend his tribe. With its dying breath, the beast curses the prince's arm, granting him demonic powers while gradually siphoning his life away. Instructed by the village elders to travel westward for a cure, Ashitaka arrives at Tatara, the Iron Town, where he finds himself embroiled in a fierce conflict: Lady Eboshi of Tatara, promoting constant deforestation, stands against Princess San and the sacred spirits of the forest, who are furious at the destruction brought by the humans. As the opposing forces of nature and mankind begin to clash in a desperate struggle for survival, Ashitaka attempts to seek harmony between the two, all the while battling the latent demon inside of him. Princess Mononoke is a tale depicting the connection of technology and nature, while showing the path to harmony that could be achieved by mutual acceptance.

[Written by MAL Rewrite]",8.68,54,100,1067414,686488,white,movie,finished_airing,"[{'id': 1, 'name': 'Action'}, {'id': 2, 'name': 'Adventure'}, {'id': 10, 'name': 'Fantasy'}]",1,original,8002,pg_13,"[{'id': 21, 'name': 'Studio Ghibli'}]",11,,,1997.0,summer,14709.0,895250.0,4203.0,1729.0,153576.0,1069467.0,0.9945,0.0055
431,Howl no Ugoku Shiro,2004-11-20,2004-11-20,"That jumbled piece of architecture, that cacophony of hissing steam and creaking joints, with smoke billowing from it as it moves on its own... That castle is home to the magnificent wizard Howl, infamous for both his magical prowess and for being a womanizer—or so the rumor goes in Sophie Hatter's small town. Sophie, as the plain daughter of a hatmaker, does not expect much from her future and is content with working hard in the shop. 

However, Sophie's simple life takes a turn for the exciting when she is ensnared in a disturbing situation, and the mysterious wizard appears to rescue her. Unfortunately, this encounter, brief as it may be, spurs the vain and vengeful Witch of the Waste—in a fit of jealousy caused by a past discord with Howl—to put a curse on the maiden, turning her into an old woman.

In an endeavor to return to normal, Sophie must accompany Howl and a myriad of eccentric companions—ranging from a powerful fire demon to a hopping scarecrow—in his living castle, on a dangerous adventure as a raging war tears their kingdom apart.

[Written by MAL Rewrite]",8.66,59,97,1092181,752385,white,movie,finished_airing,"[{'id': 2, 'name': 'Adventure'}, {'id': 8, 'name': 'Drama'}, {'id': 10, 'name': 'Fantasy'}, {'id': 22, 'name': 'Romance'}]",1,novel,7149,g,"[{'id': 21, 'name': 'Studio Ghibli'}]",12,,,2004.0,fall,11934.0,977416.0,2952.0,1172.0,101224.0,1094698.0,0.9962,0.0038
3786,Evangelion: 3.0+1.0 Thrice Upon a Time,2021-03-08,2021-03-08,"Following NERV's failed attempt to retrieve the Spears of Longinus and carry out the Human Instrumentality Project, the destruction caused by the Fourth Impact has been largely averted. In a state of disarray, Shinji Ikari, Asuka Langley Shikinami, and Rei Ayanami travel to Village 3—a survivor settlement free from Earth's ruination. There, Shinji slowly comes to terms with his past, developing an entirely different life from his days as an Evangelion pilot.

Meanwhile, Nerv makes preparations to continue the Instrumentality Project by means of a new Impact. When WILLE's main aerial battleship arrives at the village, Shinji decides to board, believing that he can help by piloting an Evangelion. As new secrets are uncovered and a battle between WILLE and NERV approaches, the future of Earth hangs in the balance. Can Shinji save humanity and the rest of the world one last time?

[Written by MAL Rewrite]",8.65,60,684,276308,91439,white,movie,finished_airing,"[{'id': 1, 'name': 'Action'}, {'id': 8, 'name': 'Drama'}, {'id': 18, 'name': 'Mecha'}, {'id': 40, 'name': 'Psychological'}, {'id': 24, 'name': 'Sci-Fi'}]",1,original,9300,pg_13,"[{'id': 47, 'name': 'Khara'}]",13,,,2021.0,winter,3675.0,111320.0,1182.0,377.0,160621.0,277175.0,0.9944,0.0056
38329,Seishun Buta Yarou wa Yumemiru Shoujo no Yume wo Minai,2019-06-15,2019-06-15,"Six months ago, Sakuta Azusagawa had a chance encounter with a bunny girl in a library. Ever since then, he's been blissfully happy with his girlfriend: Mai Sakurajima, that same bunny girl. However, the reappearance of his mysterious first crush, the now-adult Shouko Makinohara, adds a new complication to his relationship with Mai. To make matters worse, he then encounters a middle school Shouko in the hospital, suffering from a grave illness. Mysteriously, his old scars begin throbbing whenever he's near her.

With Shouko's bizarre situation somehow revolving around him, Sakuta will need to come to terms with his own conflicting feelings, for better or worse. With a girl's life in his hands, just what can he do?

[Written by MAL Rewrite]",8.63,67,302,559280,351635,white,movie,finished_airing,"[{'id': 8, 'name': 'Drama'}, {'id': 22, 'name': 'Romance'}, {'id': 23, 'name': 'School'}, {'id': 37, 'name': 'Supernatural'}]",1,light_novel,5400,pg_13,"[{'id': 1835, 'name': 'CloverWorks'}]",14,,,2019.0,spring,12096.0,434041.0,3096.0,1480.0,111363.0,562076.0,0.9919,0.0081
7311,Suzumiya Haruhi no Shoushitsu,2010-02-06,2010-02-06,"One cold Christmas day, Kyon heads over to school and the SOS Brigade's holiday celebration, only to realize that Haruhi Suzumiya seems to have disappeared. Moreover, no one even remembers her or the SOS Brigade; Mikuru Asahina knows nothing and is now afraid of him, and Itsuki Koizumi has also gone missing. The Literature Club, formed only by an uncharacteristically shy Yuki Nagato, now occupies the old SOS club room.

Suzumiya Haruhi no Shoushitsu is based on the fourth light novel of the acclaimed Haruhi series and is set after the events of the anime series. Not uncultured in the supernatural, Kyon will have to deal with his whole life turned upside down like a bad joke, and maybe it's better that way.

[Written by MAL Rewrite]",8.62,71,310,551455,279102,white,movie,finished_airing,"[{'id': 7, 'name': 'Mystery'}, {'id': 22, 'name': 'Romance'}, {'id': 23, 'name': 'School'}, {'id': 24, 'name': 'Sci-Fi'}, {'id': 37, 'name': 'Supernatural'}]",1,light_novel,9707,pg_13,"[{'id': 2, 'name': 'Kyoto Animation'}]",15,,,2010.0,winter,13277.0,357949.0,5738.0,4468.0,170437.0,551869.0,0.9815,0.0185
28957,Mushishi Zoku Shou: Suzu no Shizuku,2015-05-16,2015-05-16,"On a warm summer day, a boy heard the sound of bells ringing, as if in celebration, in the mountain near his home. Several years later in that same mountain, the mushishi Ginko encounters a strange girl with weeds growing out of her body. Soon after, Ginko coincidentally runs into the now grown-up boy Yoshiro on his way off the mountain. With Yoshiro’s help, Ginko soon begins to uncover who this mysterious girl is and what happened to her.

An adaptation of the last arc in the manga, Mushishi Zoku Shou: Suzu no Shizuku follows Ginko’s peculiar journey amidst the occult to unravel the mystery behind the enigmatic girl called Kaya and the mountain that has become her home.

[Written by MAL Rewrite]",8.6,72,1538,112646,43552,white,movie,finished_airing,"[{'id': 2, 'name': 'Adventure'}, {'id': 10, 'name': 'Fantasy'}, {'id': 13, 'name': 'Historical'}, {'id': 7, 'name': 'Mystery'}, {'id': 42, 'name': 'Seinen'}, {'id': 36, 'name': 'Slice of Life'}, {'id': 37, 'name': 'Supernatural'}]",1,manga,2820,pg_13,"[{'id': 8, 'name': 'Artland'}]",16,,,2015.0,spring,3062.0,59336.0,1208.0,643.0,48395.0,112644.0,0.9836,0.0164
12355,Ookami Kodomo no Ame to Yuki,2012-07-21,2012-07-21,"Hana, a hard-working college student, falls in love with a mysterious man who attends one of her classes though he is not an actual student. As it turns out, he is not truly human either. On a full moon night, he transforms, revealing that he is the last werewolf alive. Despite this, Hana's love remains strong, and the two ultimately decide to start a family.

Hana gives birth to two healthy children—Ame, born during rainfall, and Yuki, born during snowfall—both possessing the ability to turn into wolves, a trait inherited from their father. All too soon, however, the sudden death of her lover devastates Hana's life, leaving her to raise a peculiar family completely on her own. The stress of raising her wild-natured children in a densely populated city, all while keeping their identity a secret, culminates in a decision to move to the countryside, where she hopes Ame and Yuki can live a life free from the judgments of society. Wolf Children is the heartwarming story about the challenges of being a single mother in an unforgiving modern world.

[Written by MAL Rewrite]",8.6,73,201,721091,407997,white,movie,finished_airing,"[{'id': 10, 'name': 'Fantasy'}, {'id': 36, 'name': 'Slice of Life'}]",1,original,7020,g,"[{'id': 555, 'name': 'Studio Chizu'}]",17,,,2012.0,summer,13249.0,522217.0,4053.0,1512.0,180556.0,721587.0,0.9923,0.0077
31757,Kizumonogatari II: Nekketsu-hen,2016-08-19,2016-08-19,"No longer truly human, Koyomi Araragi decides to retrieve Kiss-shot Acerola-orion Heart-under-blade's severed body parts that were stolen by three powerful vampire hunters. Awaiting him are Dramaturgie, a vampire hunter who is a vampire himself; Episode, a half-vampire with the ability to transform into mist; and Guillotinecutter, a human priest who is the most dangerous of them all.

Unbeknownst to Araragi, each minute he spends trying to retrieve Kiss-shot's limbs makes him less of a human and more of a vampire. Will he be able to keep his wish of becoming human once again by the end of his battles?

[Written by MAL Rewrite]",8.59,75,467,381358,228109,white,movie,finished_airing,"[{'id': 1, 'name': 'Action'}, {'id': 7, 'name': 'Mystery'}, {'id': 37, 'name': 'Supernatural'}, {'id': 32, 'name': 'Vampire'}]",1,light_novel,3840,r,"[{'id': 44, 'name': 'Shaft'}]",18,,,2016.0,summer,7226.0,290431.0,2125.0,920.0,82041.0,382743.0,0.992,0.008
40664,Shoujo☆Kageki Revue Starlight Movie,2021-06-04,2021-06-04,"""Starlight"" - it's a distant star, long ago, and in the far future. Two girls, who were struck by the light of the stage in this play, exchanged their destinies.

""Two people's stars, waiting on stage.""

To burn out ordinary fun and joy and fulfill our destinies. A destiny to become a blast furnace at just 5 years old... what a danger.

Eventually the two will meet again. One continued to stand on the stage of tragedy, the other jumped in, separated, jumped in, rewrote their destinies... and created a new chapter full of light.

No girl was burned and fell from the tower, nor was she imprisoned. Then... what is the end of that new chapter?

""Starlight"" is a story of an unknown author. Where does the light come from and where does it go? And who is ""starring"" in this story?

I want to see it.

Hey -- Hanako Aishiro, a third-year student at Seisho Music Academy?

(Source: Official website)",8.58,80,5952,8151,2153,white,movie,finished_airing,"[{'id': 19, 'name': 'Music'}, {'id': 23, 'name': 'School'}]",1,original,7222,pg_13,"[{'id': 290, 'name': 'Kinema Citrus'}]",19,,,2021.0,spring,213.0,2693.0,102.0,65.0,5186.0,8259.0,0.9798,0.0202
4565,Tengen Toppa Gurren Lagann Movie 2: Lagann-hen,2009-04-22,2009-04-22,"Humans have enjoyed their lavish, peaceful, and prosperous lives for seven years since the day the almighty Spiral King was defeated—the day they reclaimed their homeland, Earth. However, the boon of this lifestyle leaves them unprepared when an unknown, hostile threat arises due to the ever-growing human population. This calamity is the Anti-Spiral—a fearsome enemy with unparalleled power. 
 
As the Spiral King's prognosis postulating the destruction of ""The Spiral's World"" begins to come true, the pieces are in place, and Team Dai-Gurren is ready. With his late brother's hope to see a better future for mankind, Simon—along with Nia Teppelin and the rest of the team—is determined to overthrow the mighty Anti-Spiral in order to revive humanity's lost hope.

[Written by MAL Rewrite]
",8.57,82,989,190837,88418,white,movie,finished_airing,"[{'id': 1, 'name': 'Action'}, {'id': 18, 'name': 'Mecha'}, {'id': 24, 'name': 'Sci-Fi'}, {'id': 29, 'name': 'Space'}, {'id': 31, 'name': 'Super Power'}]",1,original,7553,r+,"[{'id': 6, 'name': 'Gainax'}]",20,,,2009.0,spring,4187.0,126795.0,1695.0,1093.0,57243.0,191013.0,0.9854,0.0146
