id,title,start_date,end_date,synopsis,mean,rank,popularity,num_list_users,num_scoring_users,nsfw,media_type,status,genres,num_episodes,source,average_episode_duration,rating,studios,movie_ranking,broadcast_day_of_the_week,broadcast_start_time,start_season_year,start_season_season,statistics_watching,statistics_completed,statistics_on_hold,statistics_dropped,statistics_plan_to_watch,statistics_num_list_users,positive_viewership_fraction,negative_viewership_fraction
6467,Detective Conan Movie 14: The Lost Ship in the Sky,2010-04-17,2010-04-17,"One night, the Tokyo National Institute of Microorganisms is attacked by a mysterious organization calling themselves the ""Red Siamese Cats."" The group causes the explosion of a high-security lab storing a virus—said to have a mortality rate of 80% with no known cure. This act of terror dominates the headlines, overshadowing the unveiling of the world's biggest airship developed under Jirokichi Suzuki. Peculiarly, the unveiling has a note attached for Kaito ""Kaitou Kid"" Kuroba, challenging him to steal the jewel on display—the illustrious Lady Sky.

Conan Edogawa is permitted to board the airship along with Kogorou Mouri, Ran Mouri, Sonoko Suzuki, Professor Agasa, and the Detective Boys. However, their fun comes to a halt when an unknown caller contacts Jirokichi and declares that they have released a certain virus in the smoking room. Soon after, symptoms begin to appear among the passengers and chaos ensues. Seizing the opportunity, the Red Siamese Cats suddenly appear and hijack the airship! 

To stop the assailants, Conan and Kaitou Kid, along with their allies, must work together to decipher the clues and discover the Red Siamese Cats' real objective before time runs out.

[Written by MAL Rewrite]",8.12,412,2605,49739,28848,white,movie,finished_airing,"[{'id': 1, 'name': 'Action'}, {'id': 7, 'name': 'Mystery'}, {'id': 39, 'name': 'Police'}, {'id': 27, 'name': 'Shounen'}]",1,manga,6120,g,"[{'id': 65, 'name': 'Tokyo Movie Shinsha'}]",99,,,2010.0,spring,658.0,43644.0,263.0,310.0,4915.0,49790.0,0.9885,0.0115
42894,Natsume Yuujinchou: Ishi Okoshi to Ayashiki Raihousha,2021-01-16,2021-01-16,"Ishi Okoshi
While searching for Nyanko-sensei, Takashi Natsume encounters meek and small-looking youkai Mitsumi. Mitsumi was entrusted by his leader Gantetsu, a powerful and strong ayakashi, to be the year's ""Ishi Okoshi,"" whose role consists of waking him from his deep slumber. Seeing how much Mitsumi wants to prove himself as Gantetsu's worthy servant, Natsume decides to help him fulfill his task. However, time is running out—for they are not the only ones who want to awaken the divine being.

Ayashiki Raihousha
One day, Natsume's friend Kaname Tanuma is visited by a strange man. In the subsequent days, the visitor briefly talks with Tanuma and leaves. Natsume soon discovers that the outsider is a youkai disguised as a human, who claims to bear no danger. Despite trusting the youkai, Tanuma's health slowly begins to deteriorate, causing Natsume to become more suspicious of the interloper. What is the truth of his sudden appearance and his connection with Tanuma?

[Written by MAL Rewrite]",8.11,426,3651,26278,5832,white,movie,finished_airing,"[{'id': 6, 'name': 'Demons'}, {'id': 8, 'name': 'Drama'}, {'id': 25, 'name': 'Shoujo'}, {'id': 36, 'name': 'Slice of Life'}, {'id': 37, 'name': 'Supernatural'}]",1,manga,3091,pg_13,"[{'id': 1119, 'name': 'Shuka'}]",100,,,2021.0,winter,809.0,7915.0,298.0,103.0,17222.0,26347.0,0.9848,0.0152
29831,Tamayura: Sotsugyou Shashin Part 4 - Ashita,2016-04-02,2016-04-02,The final movie of a four-part finale of Tamayura.,8.1,432,5554,9589,2710,white,movie,finished_airing,"[{'id': 4, 'name': 'Comedy'}, {'id': 8, 'name': 'Drama'}, {'id': 36, 'name': 'Slice of Life'}]",1,original,3420,g,"[{'id': 333, 'name': 'TYO Animations'}]",101,,,2016.0,spring,401.0,3635.0,214.0,181.0,5184.0,9615.0,0.9589,0.0411
3016,Ginga Eiyuu Densetsu: Arata Naru Tatakai no Overture,1993-12-18,1993-12-18,"Led by Reinhard von Müsel, the Galactic Empire crushes the Free Planets Alliance in the Fourth Battle of Tiamat. Arriving in the Imperial capital of Odin to a hero's welcome, Reinhard's victory earns him a promotion to High Admiral and the distinguished title of Count von Lohengramm. On the other side, Yang Wen-li safely returns to the Alliance capital of Heinessen without fanfare and reunites with his dear friends.

Reinhard and Yang look forward to a long-awaited reprieve. However, at the request of the scheming Duke Otho von Braunschweig, the Imperial High Command orders the new High Admiral to invade the Alliance with a fleet of twenty thousand ships. After the Duke leaks the plan to the Alliance government, three fleets totalling forty thousand ships are sent to counter the incoming attack and recreate the famous Battle of Dagon. But even though Reinhard is outnumbered two to one, he has an ingenious plan—and Yang sees right through it. Will Yang's superiors heed his warning before it is too late?

[Written by MAL Rewrite]",8.1,436,3398,30156,15294,white,movie,finished_airing,"[{'id': 1, 'name': 'Action'}, {'id': 8, 'name': 'Drama'}, {'id': 38, 'name': 'Military'}, {'id': 24, 'name': 'Sci-Fi'}, {'id': 29, 'name': 'Space'}]",1,novel,5400,pg_13,"[{'id': 207, 'name': 'Magic Bus'}, {'id': 2256, 'name': 'Kitty Film Mitaka Studio'}]",102,,,1993.0,fall,566.0,19383.0,339.0,256.0,9641.0,30185.0,0.9803,0.0197
36370,Ginga Eiyuu Densetsu: Die Neue These - Seiran 2,2019-10-25,2019-10-25,"Marquis Reinhard von Lohengramm's plot to destabilize the Free Planets Alliance succeeds when the treacherous former Rear Admiral Arthur Lynch instigates a coup on Heinessen. Equipped with a plan crafted by Reinhard himself, Lynch encourages his longtime friend Admiral Dwight Greenhill to supervise the National Salvation Military Council's toppling of the civilian government. Seeking to defend democracy and restore the Alliance constitution, Admiral Yang Wen-li faces off against his fellow citizens—and, regrettably, the father of his devoted adjutant Lieutenant Frederica Greenhill.

Now with the Free Planets Alliance thoroughly occupied with their own internal matters, the forces of the Galactic Empire can safely suppress the newly formed Lippstadt League led by Duke Otto von Braunschweig. However, with his friend and loyal subordinate High Admiral Siegfried Kircheis fighting far away in the noble-controlled frontier regions, Reinhard increasingly relies on the advice of the ruthless Vice Admiral Paul von Oberstein, whose influence within the esteemed Lohengramm admiralty steadily grows.

Though bloodshed is inevitable on both sides of the galaxy, Yang Wen-li of the Alliance and Reinhard von Lohengramm of the Empire each ask themselves the same questions: how will history look back on their actions? Will the ends justify the means?

[Written by MAL Rewrite]",8.1,437,4292,18469,8928,white,movie,finished_airing,"[{'id': 1, 'name': 'Action'}, {'id': 8, 'name': 'Drama'}, {'id': 38, 'name': 'Military'}, {'id': 24, 'name': 'Sci-Fi'}, {'id': 29, 'name': 'Space'}]",4,novel,1500,r,"[{'id': 10, 'name': 'Production I.G'}]",103,,,2019.0,fall,500.0,11483.0,193.0,158.0,6284.0,18618.0,0.9811,0.0189
35110,Haikyuu!! Movie 3: Sainou to Sense,2017-09-15,2017-09-15,"Following the events of the Inter-High, the Karasuno High School volleyball team decides to regroup by attending an intensive boot camp organized by Nekoma High School in Tokyo. At the camp, the team continues to suffer loss upon loss to the other schools in attendance. Reaching an impasse, the players each struggle to break out of their routine to hone their skills. 

For the team's setter-and-ace duo Shouyou Hinata and Tobio Kageyama, the frustrations cause them to falter more than anyone else. While Hinata develops his own playstyle, his recklessness leads him to fall out of sync with Kageyama's sets and earns his partner's ire instead. As they search for an answer to their woes, the two find what they are lacking from two unlikely people. Will it be enough for the team to overcome their rut?

[Written by MAL Rewrite]
",8.1,438,2259,63876,23525,white,movie,finished_airing,"[{'id': 4, 'name': 'Comedy'}, {'id': 8, 'name': 'Drama'}, {'id': 23, 'name': 'School'}, {'id': 27, 'name': 'Shounen'}, {'id': 30, 'name': 'Sports'}]",1,manga,5340,pg_13,"[{'id': 10, 'name': 'Production I.G'}]",104,,,2017.0,summer,1519.0,42130.0,573.0,502.0,19590.0,64314.0,0.9833,0.0167
16662,Kaze Tachinu,2013-07-20,2013-07-20,"Although Jirou Horikoshi's nearsightedness prevents him from ever becoming a pilot, he leaves his hometown to study aeronautical engineering at Tokyo Imperial University for one simple purpose: to design and build planes just like his hero, Italian aircraft pioneer Giovanni Battista Caproni. His arrival in the capital coincides with the Great Kanto Earthquake of 1923, during which he saves a maid serving the family of a young girl named Naoko Satomi; this disastrous event marks the beginning of over two decades of social unrest and malaise leading up to Japan's eventual surrender in World War II.

For Jirou, the years leading up to the production of his infamous Mitsubishi A6M Zero fighter aircraft will test every fiber of his being. His many travels and life experiences only urge him onward⁠—even as he realizes both the role of his creations in the war and the harsh realities of his personal life. As time marches on, he must confront an impossible question: at what cost does he chase his beautiful dream?

[Written by MAL Rewrite]
",8.1,441,712,267832,151751,white,movie,finished_airing,"[{'id': 8, 'name': 'Drama'}, {'id': 13, 'name': 'Historical'}, {'id': 22, 'name': 'Romance'}]",1,manga,7591,pg_13,"[{'id': 21, 'name': 'Studio Ghibli'}]",105,,,2013.0,summer,4179.0,196215.0,1849.0,827.0,64980.0,268050.0,0.99,0.01
21469,Stand By Me Doraemon,2014-08-08,2014-08-08,"Nobita Nobi is an elementary student who hates studying, is bad at sports, and does everything half-heartedly. He is a pushover, unlucky, and fearful of many things. His personality makes him a failure in life, even affecting his progeny. This causes his great-great-grandchild, Sewashi, to take control of the situation.

Sewashi travels back in time from the 22nd century to the 20th century to meet Nobita, who is shocked to see him appear out of his drawer alongside a blue robotic cat. The robotic cat calls himself Doraemon, who claims to have been pressured by Sewashi to assist Nobita, with their ultimate goal being to provide Nobita happiness. Frustrated after seeing Nobita's hopeless state, Doraemon decides to go back to the future. However, Sewashi activates a program within Doraemon that prevents him from doing so. 

Forced to stay, Doraemon helps Nobita using futuristic gadgets through his four-dimensional pocket—a bag containing anything inside it. Can Doraemon bring Nobita happiness and return to the future?

[Written by MAL Rewrite]",8.08,453,2788,43241,30130,white,movie,finished_airing,"[{'id': 4, 'name': 'Comedy'}, {'id': 15, 'name': 'Kids'}, {'id': 24, 'name': 'Sci-Fi'}, {'id': 27, 'name': 'Shounen'}]",1,manga,5663,pg,"[{'id': 235, 'name': 'Shirogumi'}, {'id': 247, 'name': 'Shin-Ei Animation'}]",106,,,2014.0,summer,707.0,37293.0,197.0,297.0,4772.0,43266.0,0.9886,0.0114
21419,Detective Conan Movie 18: The Sniper from Another Dimension,2014-04-19,2014-04-19,"One morning, at the observation deck of the Bell Tree Tower, a man is suddenly shot dead by an unknown sniper. Conan Edogawa, who happened to be visiting as the murder occurred, rushes to apprehend the sniper but fails to do so. He later learns that the suspect for the incident, Timothy Hunter, is a former member of the Navy Special Ops squad and was already being investigated for a previous murder case. The FBI believes that there are at least three people Timothy wants dead. However, after the deaths of two of them, Timothy himself is killed, throwing the investigation into disarray.

As they lose their only lead, news about the assassinations spreads across Tokyo, leaving the city in a state of panic. It is up to Conan to find and catch the culprit in the hope of putting an end to this sniping spree terror.

[Written by MAL Rewrite]",8.08,458,3063,37090,21013,white,movie,finished_airing,"[{'id': 1, 'name': 'Action'}, {'id': 7, 'name': 'Mystery'}, {'id': 39, 'name': 'Police'}, {'id': 27, 'name': 'Shounen'}]",1,manga,6600,pg_13,"[{'id': 73, 'name': 'TMS Entertainment'}]",107,,,2014.0,spring,552.0,31568.0,256.0,286.0,4439.0,37101.0,0.9854,0.0146
31658,Kuroko no Basket Movie 4: Last Game,2017-03-18,2017-03-18,"Hailing from America, Jabberwock—a street basketball team with skills comparable to those of the NBA—has come to Japan to play an exhibition match against Strky, a team of former third-year students who once played in the Interhigh and Winter Cup. However, due to the vast difference in skill, Jabberwock easily wins. Their captain, Nash Gold Jr., mocks the basketball style of all players in Japan by comparing them to monkeys.
 
Infuriated by the nasty comment, Kagetora Aida challenges them to a revenge match. Because of pride and the belief that the results will be no different, Nash accepts the challenge. Kagetora then assembles Vorpal Swords, a team composed of the Generation of Miracles, including Kuroko Tetsuya and Kagami Taiga, for they are the only ones who stand a chance against a foe that seems unbeatable from every angle.

[Written by MAL Rewrite]",8.08,464,804,237839,139497,white,movie,finished_airing,"[{'id': 23, 'name': 'School'}, {'id': 27, 'name': 'Shounen'}, {'id': 30, 'name': 'Sports'}]",1,manga,5400,pg_13,"[{'id': 10, 'name': 'Production I.G'}]",108,,,2017.0,winter,4136.0,193359.0,959.0,561.0,40212.0,239227.0,0.9936,0.0064
1367,Detective Conan Movie 08: Magician of the Silver Sky,2004-04-17,2004-04-17,"Once again, Kaitou Kid crosses swords with Conan Edogawa in this annual installment of the Detective Conan movie franchise. After receiving a letter from the thief, famous actress Juri Maki seeks the help of private detective Kogorou Mouri to protect the Star Sapphire—the ""Jewel of Destiny,"" said to represent faith, fate, and hope. Thinking he has deciphered Kid's riddle, Kogorou personally shows up to the newly constructed space theater where Juri is acting in the play ""Josephine"" in order to catch Kid in the act.
 
The next day, Conan and the gang are invited by Juri to her holiday home, to celebrate the thwarting of Kid's plan and the success of the play. However, their triumph crumbles when a murder occurs during the flight there. Although unintentional, this sets off a series of events that escalate to catastrophic results. Conan and Kid, unlikely allies that they are, must work together to save both their friends and every other passenger aboard the plane.
 
[Written by MAL Rewrite]",8.07,468,2602,49882,29332,white,movie,finished_airing,"[{'id': 2, 'name': 'Adventure'}, {'id': 4, 'name': 'Comedy'}, {'id': 7, 'name': 'Mystery'}, {'id': 39, 'name': 'Police'}, {'id': 27, 'name': 'Shounen'}]",1,manga,6480,pg_13,"[{'id': 73, 'name': 'TMS Entertainment'}]",109,,,2004.0,spring,553.0,44802.0,249.0,295.0,4064.0,49963.0,0.9891,0.0109
38081,Girls & Panzer: Saishuushou Part 2,2019-06-15,2019-06-15,"Despite having the upper hand, BC Freedom High School suffers a thorough defeat at the hands of Ooarai Girls Academy. Following their victory, the Ooarai girls decide to take a break before the next round. After discovering that Momo Kawashima is taking care of her family while studying for the university entrance exams, the rest of the Ooarai team become more determined to win the Winter Continuous Track Cup for the sake of Momo and her family.

Meanwhile, the second round of the tournament has started, and Ooarai now has to face Chi-Ha-Tan Academy. Having learned from the first round to not underestimate their enemies, Ooarai slowly approaches their opponent on the thick jungle battlefield.

Despite their best attempts to be cautious, Ooarai is immediately put in a difficult situation as Chi-Ha-Tan employs several new strategies devised by Haru Fukuda. Finding themselves between a rock and a hard place, Ooarai must claw their way out to claim another comeback victory and keep their championship hopes alive.

[Written by MAL Rewrite]",8.07,474,3638,26497,11488,white,movie,finished_airing,"[{'id': 38, 'name': 'Military'}, {'id': 23, 'name': 'School'}]",1,original,3297,pg_13,"[{'id': 60, 'name': 'Actas'}]",110,,,2019.0,spring,708.0,15568.0,255.0,156.0,9978.0,26665.0,0.9846,0.0154
21557,Omoide no Marnie,2014-07-19,2014-07-19,"Suffering from frequent asthma attacks, young Anna Sasaki is quiet, unsociable, and isolated from her peers, causing her foster parent endless worry. Upon recommendation by the doctor, Anna is sent to the countryside, in hope that the cleaner air and more relaxing lifestyle will improve her health and help clear her mind. Engaging in her passion for sketching, Anna spends her summer days living with her aunt and uncle in a small town near the sea.

One day while wandering outside, Anna discovers an abandoned mansion known as the Marsh House. However, she soon finds that the residence isn't as vacant as it appears to be, running into a mysterious girl named Marnie. Marnie's bubbly demeanor slowly begins to draw Anna out of her shell as she returns night after night to meet with her new friend. But it seems there is more to the strange girl than meets the eye—as her time in the town nears its end, Anna begins to discover the truth behind the walls of the Marsh House.

Omoide no Marnie tells the touching story of a young girl's journey through self-discovery and friendship, and the summer that she will remember for the rest of her life.

[Written by MAL Rewrite]",8.07,482,785,244857,132048,white,movie,finished_airing,"[{'id': 8, 'name': 'Drama'}, {'id': 7, 'name': 'Mystery'}, {'id': 40, 'name': 'Psychological'}]",1,novel,6162,g,"[{'id': 21, 'name': 'Studio Ghibli'}]",111,,,2014.0,summer,4197.0,170730.0,1709.0,747.0,67585.0,244968.0,0.99,0.01
1506,Detective Conan Movie 10: Requiem of the Detectives,2006-04-15,2006-04-15,"After receiving a strange invitation, Kogorou Mouri pays a visit to the Miracle Land theme park along with his daughter Ran, Conan Edogawa, and the Detective Boys. Once there, Kogorou and Conan are tasked with finishing an unsolved case by a mysterious stranger. Realizing that the invitations were actually an elaborate trap, the two have just 12 hours to solve the case or face grave danger.

With the help of familiar faces like Heiji Hattori, Kaitou Kid, and even Saguru Hakuba, the group of detectives must unravel the web of clues surrounding the case in order to find the culprit and bring them to justice before it's too late.

[Written by MAL Rewrite]",8.05,489,2620,49289,28673,white,movie,finished_airing,"[{'id': 2, 'name': 'Adventure'}, {'id': 4, 'name': 'Comedy'}, {'id': 7, 'name': 'Mystery'}, {'id': 39, 'name': 'Police'}, {'id': 27, 'name': 'Shounen'}]",1,manga,6660,pg_13,"[{'id': 73, 'name': 'TMS Entertainment'}]",112,,,2006.0,spring,611.0,43849.0,251.0,287.0,4357.0,49355.0,0.9891,0.0109
5681,Summer Wars,2009-08-01,2009-08-01,"OZ, a virtual world connected to the internet, has become extremely popular worldwide as a spot for people to engage in a large variety of activities, such as playing sports or shopping, through avatars created and customized by the user. OZ also possesses a near impenetrable security due to its strong encryption, ensuring that any personal data transmitted through the networks will be kept safe in order to protect those who use it. Because of its convenient applications, the majority of society has become highly dependent on the simulated reality, even going as far as entrusting the system with bringing back the unmanned asteroid explorer, Arawashi.
 
Kenji Koiso is a 17-year-old math genius and part-time OZ moderator who is invited by his crush Natsuki Shinohara on a summer trip. But unbeknownst to him, this adventure requires him to act as her fiancé. Shortly after arriving at Natsuki's family's estate, which is preparing for her great-grandmother's 90th birthday, he receives a strange, coded message on his cell phone from an unknown sender who challenges him to solve it. Kenji is able to crack the code, but little does he know that his math expertise has just put Earth in great danger.

[Written by MAL Rewrite]",8.05,495,366,474308,270739,white,movie,finished_airing,"[{'id': 4, 'name': 'Comedy'}, {'id': 24, 'name': 'Sci-Fi'}]",1,original,6840,pg_13,"[{'id': 11, 'name': 'Madhouse'}]",113,,,2009.0,summer,7668.0,347349.0,2825.0,1428.0,115375.0,474645.0,0.991,0.009
1943,Paprika,2006-11-25,2006-11-25,"The world of dreams can be an incredible window into the psyche, showing one's deepest desires, aspirations, and repressed memories. One hopeful tech lab has been developing the ""DC Mini,"" a device with the power to delve into the dreams of others. Atsuko Chiba and Kosaku Tokita have been tirelessly working to develop this technology with the hopes of using it to deeply explore patients' minds and help cure them of their psychological disorders.

However, having access to the deepest corners of a person's mind comes with a tremendous responsibility. In the wrong hands, the DC Mini could be used as a form of psychological terrorism and cause mental breakdowns in the minds of targets. When this technology is stolen and people around them start acting strangely, Atsuko and Kosaku know they have a serious problem on their hands. Enlisting the help of Officer Konakawa, who has been receiving this experimental therapy, they search both the real and dream worlds for their mental terrorist.

[Written by MAL Rewrite]",8.04,497,387,446606,224915,white,movie,finished_airing,"[{'id': 5, 'name': 'Avant Garde'}, {'id': 10, 'name': 'Fantasy'}, {'id': 14, 'name': 'Horror'}, {'id': 7, 'name': 'Mystery'}, {'id': 40, 'name': 'Psychological'}, {'id': 24, 'name': 'Sci-Fi'}, {'id': 41, 'name': 'Suspense'}]",1,novel,5432,r+,"[{'id': 11, 'name': 'Madhouse'}]",114,,,2006.0,fall,8011.0,289384.0,3387.0,1731.0,144762.0,447275.0,0.9886,0.0114
5365,Tsumiki no Ie,2008-06-10,2008-06-10,"In a flooded town where the waters are ever-rising, an old man must constantly build new floors onto his home in order to keep dry. But when his favorite smoking pipe falls into the watery abyss beneath him, he dives into the depths of not only his house, but memories of years past.

Tsumiki no Ie is a short film about the everlasting effect of time on one's life—how it can swallow the past entirely, and how one must learn to continue moving forward despite what has already happened.

[Written by MAL Rewrite]",8.04,502,1855,87239,49407,white,movie,finished_airing,"[{'id': 46, 'name': 'Award Winning'}, {'id': 8, 'name': 'Drama'}]",1,original,723,g,"[{'id': 234, 'name': 'Oh! Production'}]",115,,,2008.0,spring,1129.0,61600.0,456.0,288.0,23843.0,87316.0,0.9915,0.0085
10534,Doraemon Movie 31: Shin Nobita to Tetsujin Heidan - Habatake Tenshi-tachi,2011-03-05,2011-03-05,"Jealous of Suneo's new robot toy, Nobita asks Doraemon to build him an even better one. Doraemon initially refuses, until Nobita accidentally discovers pieces of a mysterious robot that falls from the sky. After gathering all the robot parts and assembled them together, the giant robot, Zanda Claus, is soon completed. The duo soon learn that the robot is not a mere toy, but a powerful weapon in the fight against the coming Robot Army that is going to attack Earth and enslave the human inhabitants of it. An invasion is near, as a mysterious girl Riruru (リルル, Alternative spelling: Lilulu, Lillele [Doko Demo Doa Scanlations]) shows up, looking for the robot.

(Source: Wikipedia)",8.04,505,5433,10115,6828,white,movie,finished_airing,"[{'id': 2, 'name': 'Adventure'}, {'id': 4, 'name': 'Comedy'}, {'id': 10, 'name': 'Fantasy'}, {'id': 15, 'name': 'Kids'}, {'id': 18, 'name': 'Mecha'}, {'id': 27, 'name': 'Shounen'}]",1,unknown,6480,pg,"[{'id': 247, 'name': 'Shin-Ei Animation'}]",116,,,2011.0,winter,168.0,8825.0,64.0,178.0,893.0,10128.0,0.9761,0.0239
3783,Kara no Kyoukai 3: Tsuukaku Zanryuu,2008-02-09,2008-02-09,"On a solemn night in July 1998, teenager Fujino Asagami is mercilessly raped by a street gang in a dilapidated bar. No matter what physical or sexual abuse they deal, however, the girl regards her captors with the same apathetic expression. The next day, mangled bodies are discovered in that same building, so torn apart that investigators find it infeasible to even consider the culprit human.

Elsewhere, a client request reaches Touko Aozaki's detective agency, tasking Shiki Ryougi with either capturing or killing the perpetrator of last night's incident. But soon, word spreads that a single survivor escaped the slaughter, and now the murderer is plowing down everything in their path to locate and exterminate him. A brutal race against time begins, pitting Shiki against a dangerous foe imperceptible even to her legendary eyes. 

[Written by MAL Rewrite]",8.04,509,922,206352,125723,white,movie,finished_airing,"[{'id': 1, 'name': 'Action'}, {'id': 8, 'name': 'Drama'}, {'id': 7, 'name': 'Mystery'}, {'id': 37, 'name': 'Supernatural'}, {'id': 41, 'name': 'Suspense'}]",1,light_novel,3546,r+,"[{'id': 43, 'name': 'ufotable'}]",117,,,2008.0,winter,2745.0,162748.0,1299.0,511.0,39235.0,206538.0,0.9912,0.0088
